text,admiration,amusement,anger,annoyance,approval,caring,confusion,curiosity,desire,disappointment,disapproval,disgust,embarrassment,excitement,fear,gratitude,grief,joy,love,nervousness,optimism,pride,realization,relief,remorse,sadness,surprise,neutral;;
It's the issue with a lot of 'activists' who think all's they have to do is exist.,0,0,0,0,0,0,0,0,0,0,0,0,1,0,0,0,0,0,0,0,0,0,0,0,0,0,0,0;;
After hearing weights drop - I can't imagine they're that good for the floor....,0,0,0,0,0,0,0,0,0,0,0,0,0,0,0,0,0,0,0,0,0,0,0,0,0,0,1,0;;
Let's be real, he should have got the start anyways,0,0,0,0,0,0,0,0,0,0,0,0,0,0,0,0,0,0,0,0,0,0,0,0,0,0,0,1;;
People who live in glass houses...... [NAME]. This punk has no right to smack.,0,0,0,0,0,0,0,0,0,0,0,0,0,0,0,0,0,0,0,0,0,0,0,0,0,0,0,1;;
So many snowballs [NAME] has to tell the fans to stop LMFAO classless losers,0,0,0,0,0,0,0,0,0,0,0,0,0,0,0,0,0,0,0,0,0,0,0,0,0,0,0,1;;
Dude I love working OC. You can bounce around like 4 different districts,0,0,0,0,0,0,0,0,0,0,0,0,0,0,0,0,0,0,1,0,0,0,0,0,0,0,0,0;;
I'm sorry to hear, come see me when you die.,0,0,0,0,0,0,0,0,0,0,0,0,0,0,0,0,0,0,0,0,0,0,0,0,1,1,0,0;;
FWIW I had a terrible series of experiences at CFA and would never recommend anyone with anxiety go there.,0,0,0,0,0,0,0,0,0,0,0,0,0,0,1,0,0,0,0,0,0,0,0,0,0,0,0,0;;
Just googled him. Only thing is how do I get in contact with him.,0,0,0,0,0,0,0,1,0,0,0,0,0,0,0,0,0,0,0,0,0,0,0,0,0,0,0,0;;
>This game is dying because toxic people like you ruin it. Speak for yourself,0,0,0,0,0,0,0,0,0,1,0,0,0,0,0,0,0,0,0,0,0,0,0,0,0,0,0,0;;
More like lovely shiny apples and rotten oranges covered with mold.,0,0,0,1,0,0,0,0,0,1,0,0,0,0,0,0,0,0,0,0,0,0,0,0,0,0,0,0;;
Wonder if her steel balls make the same sound, clanging together, when they're frozen?,0,0,0,0,0,0,0,0,0,0,0,0,0,0,0,0,0,0,0,0,0,0,0,0,0,0,1,0;;
Maybe he has really bad short term memory, and is genuinely curious how the cop got his attention.,0,0,0,0,0,0,0,0,0,0,0,0,0,0,0,0,0,0,0,0,1,0,0,0,0,0,0,0;;
–??? IÉ??m a [NAME] with a Mexican wife...Based on your comments however thatÉ??s all you see and itÉ??s disgusting. GTFO racist,0,0,0,0,0,0,0,0,0,0,0,0,0,0,0,0,0,0,0,0,0,0,0,0,0,0,0,0;;
Hay girls, if you where make-up, you can't buy me chicken tendies.,0,0,0,0,0,0,0,0,0,0,0,0,0,0,0,0,0,0,0,0,0,0,0,0,0,0,0,1;;
Is that what happens is [NAME] route? I chose [NAME] and he only does once.,0,0,0,0,1,0,0,0,0,0,0,0,0,0,0,0,0,0,0,0,0,0,0,0,0,0,0,0;;
If she's making inapropriate claims thats a problem too, Im not exactly sure what your point is?,0,0,0,0,0,0,1,0,0,0,0,0,0,0,0,0,0,0,0,0,0,0,0,0,0,0,0,0;;
They were criticizing your spelling.,0,0,0,0,0,0,0,0,0,0,0,0,0,0,0,0,0,0,0,0,0,0,1,0,0,0,0,0;;
as a kpop stan and a army, i am very disappointed,0,0,0,0,0,0,0,0,0,1,0,0,0,0,0,0,0,0,0,0,0,0,0,0,0,0,0,0;;
The same here. It's hard to be alone, but not as hard as the eggshells and abuse.,0,0,0,0,0,0,0,0,0,0,0,0,0,0,0,0,0,0,0,0,1,0,0,0,0,0,0,0;;
I personally am very proud to be a vegetable. Corn, to be exact. Corn pride y'all,1,0,0,0,0,0,0,0,0,0,0,0,0,0,0,0,0,0,0,0,0,0,0,0,0,0,0,0;;
ThatÉ??s ridiculous. IÉ??ll read it, thanks.,0,0,0,0,0,0,0,0,0,0,0,1,0,0,0,1,0,0,0,0,0,0,0,0,0,0,0,0;;
Thank you for the info and source. My source is only from guides, experience, [NAME] videos, and [NAME] videos.,0,0,0,0,0,0,0,0,0,0,0,0,0,0,0,0,0,0,0,0,0,0,0,0,0,0,0,1;;
Yay, just in time for the commute,0,0,0,0,0,0,0,0,0,0,0,0,0,0,0,0,0,0,0,0,0,0,0,1,0,0,0,0;;
[NAME] absolutely embarassed Milksmith in the game we've lost against the Griz. It never would've happened if we had AD.,0,0,0,0,0,0,0,0,0,0,0,0,1,0,0,0,0,0,0,0,0,0,0,0,0,0,0,0;;
I'd say Sprite as chaser,0,0,0,0,0,0,0,0,0,0,0,0,0,0,0,0,0,0,0,0,0,0,0,0,0,0,0,1;;
Look at a calendar. Look at the 14th. Look at the week that contains the 14th. That week, any of the days on that week. ,0,0,0,0,0,0,0,0,0,0,0,0,0,0,0,0,0,0,0,0,0,0,1,0,0,0,0,0;;
"For some reason, I read the ""no tears"" part like they want you to stop crying.,0,0,0,0,0,1,0,0,0,0,0,0,0,0,0,0,0,0,0,0,0,0,0,0,0,0,0,0";;
ALL HAIL THE RAT KING!,0,0,0,0,0,0,0,0,0,0,0,0,0,0,0,0,0,0,0,0,0,0,0,0,0,0,0,1;;
For some reason I read that in [NAME]' voice lmao,0,0,0,0,0,0,0,0,0,0,0,0,0,0,0,0,0,0,0,0,0,0,0,0,0,0,0,1;;
The fact their team is stacked makes me hate them, along with [NAME] being a dirty player. Also they are in our division ,0,0,0,0,0,0,0,0,0,0,1,0,0,0,0,0,0,0,0,0,0,0,0,0,0,0,0,0;;
Was he rejected because of his methodology or because of the content of his studies?,0,0,0,0,0,0,1,0,0,0,0,0,0,0,0,0,0,0,0,0,0,0,0,0,0,0,0,0;;
This must be what you get angry about when you donÉ??t have any actual problems in your life.,0,0,0,1,0,0,0,0,0,0,0,0,0,0,0,0,0,0,0,0,0,0,0,0,0,0,0,0;;
It's disturbing that you even have to ask that.,0,0,0,0,0,0,0,0,0,0,1,1,0,0,0,0,0,0,0,0,0,0,0,0,0,0,0,0;;
Of course, us first borns gotta stick together. Éùœã˜è,0,0,0,0,1,0,0,0,0,0,0,0,0,0,0,0,0,0,0,0,0,0,0,0,0,0,0,0;;
I'm sorry that happened to you. You planned a awesome day that I wouldve loved celebrating with you. Happy Birthday,1,0,0,0,0,0,0,0,0,0,0,0,0,1,0,0,0,0,0,0,0,0,0,0,0,1,0,0;;
He just posted an update. He seems to want to but isnÉ??t sure if he/his wife can handle a 4yo.,0,0,0,0,0,0,0,0,0,0,0,0,0,0,0,0,0,0,0,0,0,0,0,0,0,0,0,1;;
OH YEAH ITS FINE,0,0,0,0,0,0,0,0,0,0,0,0,0,0,0,0,0,0,0,0,0,0,0,0,0,0,0,1;;
I'm not sure I'm following what your point is.,0,0,0,0,0,0,0,0,0,0,0,0,0,0,0,0,0,0,0,0,0,0,0,0,0,0,0,1;;
I started following the Lions in 2001. Talk about a bad time to start following a franchise.,0,0,0,1,0,0,0,0,0,0,0,0,0,0,0,0,0,0,0,0,0,0,0,0,0,0,0,0;;
Banning abortion causes way more harm than good and is evil to be against. Same with requiring suffering people to suffer. you seem evil,0,0,0,0,0,0,0,0,0,0,0,0,0,0,0,0,0,0,0,0,0,0,0,0,0,0,0,1;;
Yeah thank you you ungrateful bast.....,0,0,0,0,0,0,0,0,0,0,0,0,0,0,0,1,0,0,0,0,0,0,0,0,0,0,0,0;;
This is amazing,1,0,0,0,0,0,0,0,0,0,0,0,0,0,0,0,0,0,0,0,0,0,0,0,0,0,0,0;;
[NAME], that's pretty damn good for a state like Virginia, which, although not a swing state anymore, was red not so long ago. ,1,0,0,0,0,0,0,0,0,0,0,0,0,0,0,0,0,0,0,0,0,0,0,0,0,0,0,0;;
JFC, they can't help themselves.,0,0,0,0,0,0,0,0,0,0,0,0,0,0,0,0,0,0,0,0,0,0,0,0,0,0,0,1;;
2017's sky high fees proved that this tech fails on a large scale. It's a disappointing reality.,0,0,0,0,0,0,0,0,0,1,0,0,0,0,0,0,0,0,0,0,0,0,0,0,0,0,0,0;;
He had a hat trick with Cruz Azul in what I think was his debut in the CONCACAF Champions League. Really wish he was given more of a chance,0,0,0,0,0,0,0,0,0,0,0,0,0,0,0,0,0,0,0,0,1,0,0,0,0,0,0,0;;
You did so good for yourself though! If you had the mother you deserve she would have the sense to be proud of you. :),1,0,0,0,0,0,0,0,0,0,0,0,0,0,0,0,0,1,0,0,0,1,0,0,0,0,0,0;;
Her husband is disgusting. I canÉ??t even look at the cute baby when his face is in the shot.,0,0,0,1,0,0,0,0,0,0,0,1,0,0,0,0,0,0,0,0,0,0,0,0,0,0,0,0;;
I really can't remember the last time my mind was this blown by an OP on this sub, and that's saying a lot.,0,0,0,0,0,0,1,0,0,0,0,0,0,0,0,0,0,0,0,0,0,0,0,0,0,0,0,0;;
Maybe 5-10 games in the g league would help knock some rust off?,0,0,0,0,0,1,0,0,0,0,0,0,0,0,0,0,0,0,0,0,0,0,0,0,0,0,0,0;;
Yes I do mean it positively and I have used a sous vide and it does come out looking rare,0,0,0,0,1,0,0,0,0,0,0,0,0,0,0,0,0,0,0,0,0,0,1,0,0,0,0,0;;
Hahaha, that's brilliant. Stupid and hilarious. ,0,1,0,0,0,0,0,0,0,0,0,0,0,0,0,0,0,0,0,0,0,0,0,0,0,0,0,0;;
I don't know what that is so I dont care... you wont hear me clapping,0,0,0,0,0,0,0,0,0,0,0,0,0,0,0,0,0,0,0,0,0,0,0,0,0,0,0,1;;
Can you link this somewhere. Im not too sure what you are referring too.,0,0,0,0,0,0,1,0,0,0,0,0,0,0,0,0,0,0,0,0,0,0,0,0,0,0,0,0;;
After two years, you actually get used to it! It doesn't become as much of a necessity anymore! ,0,0,0,0,0,0,0,0,0,0,0,0,0,0,0,0,0,0,0,0,0,0,1,0,0,0,0,0;;
What a state in America looks like when recreational marijuana gets legalized. –???,0,0,0,0,0,0,0,1,0,0,0,0,0,0,0,0,0,0,0,0,1,0,0,0,0,0,0,0;;
I remember being so excited when we got AAA back, even though it cost us Fournier...man, that sure went south. #ThanksShaw,0,0,0,0,0,0,0,0,0,0,0,0,0,1,0,1,0,0,0,0,0,0,0,0,0,0,0,0;;
I think the real reason is good press and booze,0,0,0,0,0,0,0,0,0,0,0,0,0,0,0,0,0,0,0,0,0,0,0,0,0,0,0,1;;
So many of [NAME] haters dismiss his top 10 stat placement. Never understood that.,0,0,0,0,0,0,0,0,0,0,0,0,0,0,0,0,0,0,0,0,0,0,0,0,0,0,0,1;;
I thought that was the [NAME] special,0,0,0,0,0,0,0,0,0,0,0,0,0,0,0,0,0,0,0,0,0,0,1,0,0,0,0,0;;
Great game! Got more intense as it went on.,1,0,0,0,0,0,0,0,0,0,0,0,0,1,0,0,0,0,0,0,0,0,0,0,0,0,0,0;;
yes, very sexist,1,0,0,0,0,0,0,0,0,0,0,0,0,0,0,0,0,0,0,0,0,0,0,0,0,0,0,0;;
I've done this my whole life though...,0,0,0,0,1,0,0,0,0,0,0,0,0,0,0,0,0,0,0,0,0,0,0,0,0,0,0,0;;
Duh, but it should also make it understandable why many people donÉ??t. ,0,0,0,0,0,0,0,0,0,0,0,0,0,0,0,0,0,0,0,0,0,0,0,0,0,0,0,1;;
Which will happen.,0,0,0,0,0,0,0,0,0,0,0,0,0,0,0,0,0,0,0,0,0,0,0,0,0,0,0,1;;
Love [NAME], but he is really dumb when it comes to politics and economics.,0,0,0,0,0,0,0,0,0,0,0,0,0,0,1,0,0,0,1,0,0,0,0,0,0,0,0,0;;
Love the user name ;),1,0,0,0,0,0,0,0,0,0,0,0,0,0,0,0,0,0,0,0,0,0,0,0,0,0,0,0;
This is obviously ironic,1,0,0,0,0,0,0,0,0,0,0,0,0,0,0,0,0,0,0,0,0,0,0,0,0,0,0,0;;
Was just thinking that. Great tunes,0,0,0,0,0,0,0,0,0,0,0,0,0,0,0,1,0,0,0,0,0,0,0,0,0,0,0,0;;
I will take it a as serious question. Sorry. I am in Europe,0,0,0,0,0,0,0,0,0,0,0,0,0,0,0,0,0,0,0,0,0,0,0,0,0,1,0,0;;
After Ohtani, I can't bring myself to believe any of these unverified twitter rumors again.,0,0,0,0,0,0,0,0,0,0,1,0,0,0,0,0,0,0,0,0,0,0,0,0,0,0,0,0;;
Yup, it's pretty funny to know we technically use the metric system.,0,1,0,0,0,0,0,0,0,0,0,0,0,0,0,0,0,0,0,0,0,0,0,0,0,0,0,0;;
Sometimes I think it's like the movie *Shallow Hal*. You see the person for who they really are on the inside, and it's terrifying.,0,0,0,0,0,0,0,0,0,0,0,0,0,0,1,0,0,0,0,0,0,0,0,0,0,0,0,0;;
Generally, yes. That doesnÉ??t make being attractive necessary criteria for being successful and it doesnÉ??t detract from any of your positive qualities,0,0,0,0,0,0,0,0,0,0,1,0,0,0,0,0,0,0,0,0,0,0,0,0,0,0,0,0;;
Post this to /r/MurderedByWords I legit wanna see the teeth mashing,0,0,0,0,0,0,0,0,0,0,0,0,0,0,0,0,0,0,0,0,0,0,0,0,0,0,0,1;;
Were minor children part of the divorce?,0,0,0,0,0,0,0,1,0,0,0,0,0,0,0,0,0,0,0,0,0,0,0,0,0,0,0,0;;
DonÉ??t do this. Unless youÉ??re a total prick. Communicate like an adult, donÉ??t play games like a child.,0,0,0,1,0,0,0,0,0,0,0,0,0,0,0,0,0,0,0,0,0,0,0,0,0,0,0,0;;
WITH not without,0,0,0,0,0,0,0,0,0,0,0,0,0,0,0,0,0,0,0,0,0,0,0,0,0,0,0,0;;
Great report! They are correct, it was never a hack.,1,0,0,0,0,0,0,0,0,0,0,0,0,0,0,0,0,0,0,0,0,0,0,0,0,0,0,0;;
Noooo I missed the blood moon again. Someone post a pic,0,0,0,0,0,0,0,0,0,0,1,0,0,0,0,0,0,0,0,0,0,0,0,0,0,0,0,0;;
Haha .. In pakistan 47 is the normal temp during summer... Lol noob.. Gg ez,0,1,0,0,0,0,0,0,0,0,0,0,0,0,0,0,0,0,0,0,0,0,0,0,0,0,0,0;;
My father has been dead for two years and it's still been difficult to not talk about him as if he's still alive.,0,0,0,0,0,0,0,0,0,0,0,0,0,0,0,0,1,0,0,0,0,0,0,0,0,0,0,0;;
I still wish if we get a deeper face customization like in RPGs.,0,0,0,0,0,0,0,0,1,0,0,0,0,0,0,0,0,0,0,0,0,0,0,0,0,0,0,0;;
To me he's extremely funny. Love him.,0,1,0,0,0,0,0,0,0,0,0,0,0,0,0,0,0,0,1,0,0,0,0,0,0,0,0,0;;
Is it allowed be recast in other languages (like spanish)?,0,0,0,0,0,0,0,1,0,0,0,0,0,0,0,0,0,0,0,0,0,0,0,0,0,0,0,0;;
I really want external armor vests. Luckily, I'm the Chief so I can say what goes.,0,0,0,0,1,0,0,0,0,0,0,0,0,0,0,0,0,0,0,0,0,0,0,0,0,0,0,0;;
I feel with him...,0,0,0,0,0,1,0,0,0,0,0,0,0,0,0,0,0,0,0,0,0,0,0,0,0,0,0,0;;
It's holiday time here in Europe. Today is my first day in work for 2 weeks.,0,0,0,0,0,0,0,0,0,0,0,0,0,1,0,0,0,0,0,0,0,0,0,0,0,0,0,0;;
Idk I always hear thing about them like theyÉ??re all monsters,0,0,0,0,1,0,0,0,0,0,0,0,0,0,0,0,0,0,0,0,0,0,0,0,0,0,0,0;;
I will pray for your marriage. After we win.,0,0,0,0,0,0,0,0,0,0,0,0,0,0,0,0,0,0,0,0,0,0,0,0,0,0,0,1;;
Wow this is pretty interesting. We should have a thread about what's it like to grow up in a polygamous household,1,0,0,0,0,0,0,0,0,0,0,0,0,0,0,0,0,0,0,0,0,0,0,0,0,0,0,0;;
whyyyyy !!!! ughhh,0,0,0,0,0,0,0,0,0,0,0,0,0,0,0,0,0,0,0,0,0,0,0,0,0,0,0,1;;
Okay just thought it would be a good idea.,0,0,0,0,0,0,0,0,0,0,0,0,0,0,0,0,0,0,0,0,1,0,0,0,0,0,0,0;;
My 2 best girls in the series combined into one and [NAME] with [NAME] colors is so beautiful :),1,0,0,0,0,0,0,0,0,0,0,0,0,0,0,0,0,0,0,0,0,0,0,0,0,0,0,0;;
your vehicle is pretty!,1,0,0,0,0,0,0,0,0,0,0,0,0,0,0,0,0,0,0,0,0,0,0,0,0,0,0,0;;
I found all mutual nut destruction games to be ridiculous and I never played them. My friends all loved them though.,0,0,0,0,0,0,0,0,0,0,0,0,0,0,0,0,0,0,1,0,0,0,0,0,0,0,0,0;;
[NAME] consistently being the guy with most energy. We need him on the floor more.,1,0,0,0,0,0,0,0,0,0,0,0,0,0,0,0,0,0,0,0,0,0,0,0,0,0,0,0;;
Oooo sounds lovely. Armpit hair on É??fleekÉ?ù,0,0,0,0,0,0,0,0,0,0,0,0,0,0,0,0,0,0,1,0,0,0,0,0,0,0,0,0;;
It was deloitte wasn't it. That is some bullshit application.,0,0,0,1,0,0,0,0,0,0,0,0,0,0,0,0,0,0,0,0,0,0,0,0,0,0,0,0;;
Wait what? Person on page 34, meet person on page Star. Lets stop. We aren't having the same conversation here.,0,0,0,0,0,0,1,0,0,0,0,0,0,0,0,0,0,0,0,0,0,0,0,0,0,0,0,0;;
He got his drawers blowed off,0,0,0,0,0,0,0,0,0,0,0,0,0,0,0,0,0,0,0,0,0,0,1,0,0,0,0,0;;
Eh I work oilfield so my sample of peoples opinions is probably pretty skewed. Still super embarrassing knowing this many people are so ignorant.,0,0,0,1,0,0,0,0,0,0,0,0,1,0,0,0,0,0,0,0,0,0,0,0,0,0,0,0;;
I feel like you need to get out of your current situation for the sake of your own happiness.,0,0,0,0,0,1,0,0,0,0,0,0,0,0,0,0,0,0,0,0,0,0,0,0,0,0,0,0;;
I had a total of 5 pet chickens. No way I could've ever eaten any of them. Glad that gfather confirmed that Banana Chip was buried.,0,0,0,0,0,0,0,0,0,0,0,0,0,0,0,0,0,0,0,0,1,0,0,1,0,1,0,0;;
I shout at my kid from the sidelines to stop fucking about with the draw-sting on his shorts...think I've got a shot?,0,0,1,1,0,0,0,0,0,0,0,0,0,0,0,0,0,0,0,0,0,0,0,0,0,0,0,0;;
None of the movies deserve it and honestly the oscars are a sham at this point.,0,0,0,0,0,0,0,0,0,1,0,0,0,0,0,0,0,0,0,0,0,0,0,0,0,0,0,0;;
Sorry im a french guy,0,0,0,0,0,0,0,0,0,0,0,0,0,0,0,0,0,0,0,0,0,0,0,0,0,1,0,0;;
What? I donÉ??t just want to sleep with him. I want more idk... I value myself,0,0,0,0,0,0,0,0,0,0,1,0,0,0,0,0,0,0,0,0,0,0,0,0,0,0,0,0;;
aha American Sniper, movie genuinely moved me.,1,0,0,0,0,0,0,0,0,0,0,0,0,0,0,0,0,0,0,0,0,0,0,0,0,0,0,0;;
Made my day,0,0,0,0,0,0,0,0,0,0,0,0,0,0,0,0,0,1,0,0,0,0,0,0,0,0,0,0;;
It feels oddly comforting and familiar that we suck at hockey again.,0,0,0,0,1,0,0,0,0,1,0,0,0,0,0,0,0,0,0,0,0,0,1,0,0,0,0,0;;
Might is generous lol. He totally killed that guy.,0,1,0,0,0,0,0,0,0,0,0,0,0,0,0,0,0,0,0,0,0,0,0,0,0,0,0,0;;
What a beautiful sight that was to behold. Glad I was able to attend a couple of great [NAME] performances. É??KÉ?ù signs everyone,0,0,0,0,0,0,0,0,0,0,0,0,0,1,0,0,0,1,0,0,0,0,0,0,0,0,0,0;;
I bet you are. Btw, wtf is PNW so next time I'm there I'll know to hit you up,0,0,0,0,0,0,1,1,0,0,0,0,0,0,0,0,0,0,0,0,0,0,0,0,0,0,0,0;;
So youÉ??ve never had a fwb situation and if you have it made you worthless for a real relationship to other women? Hope this goes both ways,0,0,0,0,0,0,0,0,0,0,0,0,0,0,0,0,0,0,0,0,0,0,0,0,0,0,0,1;;
I think all coffee is keto already....,0,0,0,0,0,0,0,0,0,0,0,0,0,0,0,0,0,0,0,0,0,0,0,0,0,0,0,1;;
When youÉ??re having a dream and the psycho is coming for you but you canÉ??t move...,0,0,0,0,0,0,0,0,0,0,0,0,0,0,1,0,0,0,0,1,0,0,0,0,0,0,0,0;;
Man you take your sims really seriously.,0,0,0,1,0,0,0,0,0,0,0,0,0,0,0,0,0,0,0,0,0,0,0,0,0,0,0,0;;
Low life basement dweller buttcoiner says what?,0,0,0,0,0,0,0,0,0,0,0,0,0,0,0,0,0,0,0,0,0,0,0,0,0,0,0,1;;
stay safe man,0,0,0,0,0,1,0,0,0,0,0,0,0,0,0,0,0,0,0,0,0,0,0,0,0,0,0,0;;
Awesome, love the input! I totally get what youÉ??re saying!,1,0,0,0,0,0,0,0,0,0,0,0,0,0,0,0,0,0,0,0,0,0,1,0,0,0,0,0;;
Could be worse, could be funky town,0,0,0,1,0,0,0,0,0,0,0,0,0,0,0,0,0,1,0,0,0,0,0,0,0,0,0,0;;
Nice man!! Wish you guys the best. Here I am FA again after a 2 1/2 year relationship ended lol so enjoy it while it lasts,0,1,0,0,0,1,0,0,0,0,0,0,0,0,0,0,0,1,0,0,0,0,0,0,0,0,0,0;;
You're not wrong. We move better in a chaotic atmosphere rather than a structured one.,0,0,0,0,1,0,0,0,0,0,0,0,0,0,0,0,0,0,0,0,0,0,0,0,0,0,0,0;;
That's brutal. Hope they win to make it worth your while.,0,0,1,0,0,0,0,0,0,0,0,0,0,0,0,0,0,0,0,0,0,0,0,0,0,0,0,0;;
Thank you! On the positive side IÉ??ve gotten a lot of work done after panicking and giving up looking for my pill pack,0,0,0,0,0,0,0,0,0,0,0,0,0,0,0,1,0,0,0,0,0,0,0,0,0,0,0,0;;
Flip him for another 3rd rounder hah,0,1,0,0,0,0,0,0,0,0,0,0,0,0,0,0,0,0,0,0,0,0,0,0,0,0,0,0;;
Dude, y'all anti American scum don't even believe in science. Fuck off with your generic bullshit because you can't list a specific example. ,0,0,1,0,0,0,0,0,0,0,0,0,0,0,0,0,0,0,0,0,0,0,0,0,0,0,0,0;;
This is the single dumbest defense out there for aim assist. This shit is just retarded.,0,0,0,0,0,0,0,0,0,0,1,0,0,0,0,0,0,0,0,0,0,0,0,0,0,0,0,0;;
Bore off, you pearl-clutching, centerist coward. ,0,0,1,0,0,0,0,0,0,0,0,0,0,0,0,0,0,0,0,0,0,0,0,0,0,0,0,0;;
Id buy those shoes and walk in the dirtiest places just to piss [NAME] off.,0,0,0,0,0,0,0,0,0,0,0,0,0,0,0,0,0,0,0,0,0,0,0,0,0,0,0,1;;
Trial by jury of my peers is honestly my worst fear,0,0,0,0,0,0,0,0,0,0,0,0,0,0,1,0,0,0,0,1,0,0,0,0,0,0,0,0;;
thats cool to hear ... [NAME] really is laughable in this regard,0,1,0,0,0,0,0,0,0,0,0,0,0,0,0,0,0,0,0,0,0,0,0,0,0,0,0,0;;
WeÉ??re looking good so far,0,0,0,0,0,0,0,0,0,0,0,0,0,0,0,0,0,0,0,0,0,1,0,0,0,0,0,0;;
But instead of dunking on [NAME] they're dunking on [NAME],0,0,0,0,0,0,0,0,0,0,0,0,0,0,0,0,0,0,0,0,0,0,0,0,0,0,0,1;;
[NAME] still has the most TDs, as a receiver, this season out of anyone... He needs to chill.,0,0,0,0,0,1,0,0,0,0,0,0,0,0,0,0,0,0,0,0,0,0,0,0,0,0,0,0;;
I don't know you or your story, but I fucking love your syntax, word choice, etc 10/10 would trip with,1,0,0,0,0,0,0,0,0,0,0,0,0,0,0,0,0,0,1,0,0,0,0,0,0,0,0,0;;
Ok so now you know what this dude is about. Give him no more chances and move on past him asap.,0,0,0,0,0,0,0,0,0,0,0,0,0,0,0,0,0,0,0,0,0,0,0,0,0,0,0,1;;
I didnÉ??t really need those 25 minutes of my life anyway,0,0,0,0,0,0,0,0,0,1,1,0,0,0,0,0,0,0,0,0,0,0,0,0,0,0,0,0;;
Lol omg yesssss. Probably the best suggestion anyone ever told me –???–?è¨,1,1,0,0,1,0,0,0,0,0,0,0,0,0,0,0,0,0,0,0,0,0,0,0,0,0,0,0;;
That sounds terrible, man. Have you been to a doctor yet?,0,0,0,0,0,0,1,0,0,0,0,0,0,0,0,0,0,0,0,0,0,0,0,0,0,0,0,0;;
The problem is I have no clue where he stands as heÉ??s so far on her side.,0,0,0,0,0,0,0,0,0,0,0,0,0,0,0,0,0,0,0,0,0,0,0,0,0,0,0,1;;
How are you 100% positive that you're pregnant if you haven't taken a test yet?,0,0,0,0,0,0,0,1,0,0,0,0,0,0,0,0,0,0,0,0,0,0,0,0,0,0,0,0;;
That looks righteous!!,1,0,0,0,0,0,0,0,0,0,0,0,0,0,0,0,0,1,0,0,1,0,0,0,0,0,0,0;;
"glad she;'s back inside, tragic what shes doing to this dude and his family they r the ones picking up the tab. ,0,0,0,0,0,0,0,0,0,0,0,0,0,0,0,1,0,0,0,0,0,0,0,0,0,0,0,0";;
That would be nice,0,0,0,0,0,0,0,0,1,0,0,0,0,0,0,0,0,0,0,0,1,0,0,0,0,0,0,0;;
Now youÉ??re reddit staking me? DonÉ??t comment on my stuff dude.. gtfoh,0,0,0,1,0,0,0,0,0,0,0,0,0,0,0,0,0,0,0,0,0,0,0,0,0,0,0,0;;
Good for them,0,0,0,0,1,0,0,0,0,0,0,0,0,0,0,0,0,0,0,0,0,0,0,0,0,0,0,0;;
sorry for the dumb question, but where do the pagers get their signal from? Are there still emitter around or do cellphone towers this job now?,0,0,0,0,0,0,1,1,0,0,0,0,0,0,0,0,0,0,0,0,0,0,0,0,0,0,0,0;;
Was almost hit by some idiot yesterday that drove straight through a red light and into a crossing.,0,0,1,0,0,0,0,0,0,0,0,0,0,0,0,0,0,0,0,0,0,0,0,0,0,0,0,0;;
Quite superpower you got there, op. Reminds me of [NAME] in Unbreakable. U beautiful person!,1,0,0,0,0,0,0,0,0,0,0,0,0,0,0,0,0,0,0,0,0,1,0,0,0,0,0,0;;
Lol. I will be bartending and serving.,0,0,0,0,0,0,0,0,0,0,0,0,0,0,0,0,0,0,0,0,0,0,0,0,0,0,0,1;;
The only life that needs to be ended here is the life of the guy that raped your daughter. Abortion is just medicine,0,0,0,0,0,0,0,0,0,0,0,0,0,0,0,0,0,0,0,0,0,0,0,0,0,0,0,1;;
How do they know how tall you are while your sitting in your car. Such bullshit.,0,0,0,0,0,0,0,0,0,0,0,1,0,0,0,0,0,0,0,0,0,0,0,0,0,0,0,0;;
I know North America is a big place but I wonder what it will take to see similar crowds in cities over here.,0,0,0,0,0,0,0,0,0,0,0,0,0,0,0,0,0,0,0,0,0,0,0,0,0,0,1,0;;
Can confirm he does not follow the 49ers on Instagram.,0,0,0,0,0,0,0,0,0,0,0,0,0,0,0,0,0,0,0,0,0,0,0,0,0,0,0,1;;
He is too quiet in games too often. Not to good at mid and deep catches,0,0,0,0,0,0,0,0,0,1,0,0,0,0,0,0,0,0,0,0,0,0,0,0,0,0,0,0;;
You know this is really messed up and unacceptable, but it mainly forced the realization that IÉ??ve never played with Omniknight.,0,0,0,0,0,0,0,0,0,0,1,0,0,0,0,0,0,0,0,0,0,0,0,0,0,0,0,0;;
I mean, the whole point of this sub is to complain about not having a plate ...,0,0,0,0,0,0,0,0,0,0,0,0,0,0,0,0,0,0,0,0,0,0,0,0,0,0,0,1;;
>[NAME] & [NAME], [NAME] are only DMs who could be best DMs at the moment Three completely different players. ,0,0,0,0,0,0,0,0,0,0,0,0,0,0,0,0,0,0,0,0,0,0,0,0,0,0,0,1;;
I know a lot of people around my rural area who did. These are people my age ~28 sharing this tigger the libs crap.,0,0,0,0,1,0,0,0,0,0,0,0,0,0,0,0,0,0,0,0,0,0,0,0,0,0,0,0;;
Please get them into it. Toronto needs a better barn,0,0,0,0,0,0,0,0,1,0,0,0,0,0,0,0,0,0,0,0,0,0,0,0,0,0,0,0;;
Bernie Sanders and a hairbrush.,0,0,0,0,0,0,0,0,0,0,0,0,0,0,0,0,0,0,0,0,0,0,0,0,0,0,0,0;;
Is it that good ? i'd need it too in that case :(,0,0,0,0,0,0,1,0,0,0,0,0,0,0,0,0,0,0,0,0,0,0,0,0,0,1,0,0;;
This happens to me a lot. I'll also sing the same phrase over and over.,0,0,0,0,0,0,0,0,0,0,0,0,0,0,0,0,0,1,0,0,0,0,0,0,0,0,0,0;;
My wife is a rams fan. I donÉ??t like them, but I think I like them more than the patriots lol,0,0,0,0,0,0,0,0,0,0,0,0,0,0,0,0,0,1,0,0,0,0,0,0,0,0,0,0;;
From the post history, I'd say this looks like a highly inept karma farm bot account. Edit: OP is for real! Yay! Upvoting!,0,0,0,0,0,0,0,0,0,0,0,0,0,0,0,0,0,0,0,0,0,0,0,0,0,0,0,0;;
Thoughts and Prayers... Go get fucked, fascist redneck scum!,0,0,1,0,0,0,0,0,0,0,0,0,0,0,0,0,0,0,0,0,0,0,0,0,0,0,0,0;;
Tell me more about this policy. They still fire here for defending yourself.,0,0,0,0,0,0,0,0,0,0,0,0,0,0,0,0,0,0,0,0,0,0,0,0,0,0,0,1;;
I unintentionally read this from right to left this time, probably because I recognized this meme and know that it normally is the wrong way. I fooled myself ,0,0,0,0,1,0,0,0,0,0,0,0,0,0,0,0,0,0,0,0,0,0,0,0,0,0,0,0;;
No she does not, not alone and not during sex(sadly) ,0,0,0,0,0,0,0,0,0,0,0,0,0,0,0,0,0,0,0,0,0,0,0,0,0,1,0,0;;
We have one, a daughter, and she is 8. She believes in [NAME], but she really loves science and asking hard questions :),0,0,0,0,1,0,0,0,0,0,0,0,0,0,0,0,0,0,0,0,0,0,0,0,0,0,0,0;;
My overly processed vegan avocados are slowly killing me,0,0,0,0,0,0,0,0,0,1,0,0,1,0,0,0,0,0,0,0,0,0,0,0,0,0,0,0;;
When she asks how he lost his arm she is looking up to him,0,0,0,0,0,0,0,0,0,0,0,0,0,0,0,0,0,0,0,0,0,0,0,0,0,0,0,1;;
Downtown Charlotte at a pretty nice restaurant too Edit: missed the when part. This happened around spring 2017,0,0,0,0,0,0,0,0,0,1,0,0,0,0,0,0,0,0,0,0,0,0,0,0,0,0,0,0;;
I think you two are obligated to go to bed together now.,0,0,0,0,0,0,0,0,0,0,0,0,0,0,0,0,0,0,0,0,0,0,0,0,0,0,0,1;;
Sounds like a good deal to me. Where do I sign?,1,0,0,0,0,0,0,0,0,0,0,0,0,0,0,0,0,0,0,0,0,0,0,0,0,0,0,0;;
**DRUMPF IS FINISHED** - said every liberal, every day, for the past three years. ,0,0,0,0,0,0,0,0,0,0,0,0,0,0,0,0,0,0,0,0,0,0,0,0,0,0,0,1;;
Just subscribed! Keep strong bro focus on the end goal :),0,0,0,0,0,1,0,0,0,0,0,0,0,0,0,0,0,0,0,0,0,0,0,0,0,0,0,0;;
"If that's true, then you can't call what I would have with option 1 ""omnipotence"".,0,0,0,0,0,0,0,0,0,0,0,0,0,0,0,0,0,0,0,0,0,0,0,0,0,0,0,1";;
Yup, it was a complete waste of time.,0,0,0,0,0,0,0,0,0,0,0,0,0,0,0,0,0,0,0,0,0,0,0,0,0,0,0,1;;
What they are doing is called Parent Annihilation. Courts take that very seriously.,0,0,0,0,0,0,0,0,0,0,0,0,0,0,0,0,0,0,0,0,0,0,0,0,0,0,0,1;;
Is [NAME] okay?,0,0,0,0,0,0,0,1,0,0,0,0,0,0,0,0,0,0,0,0,0,0,0,0,0,0,0,0;;
That's what I thought! Kotake and Koume!,0,0,0,0,0,0,0,0,0,0,0,0,0,0,0,0,0,0,0,0,0,0,0,0,0,0,0,1;;
Kids in Africa could have eaten those cigarettes.. :( Kidding. Good for you man. Congrats!,0,1,0,0,0,0,0,0,0,0,0,0,0,0,0,0,0,0,0,0,0,0,0,0,0,0,0,0;;
Good point, itÉ??s nice and frustrating for both sides I see. Definitely worse for the lower levels. ThatÉ??s too bad,0,0,0,0,0,0,0,0,0,0,1,1,0,0,0,0,0,0,0,0,0,0,0,0,0,0,0,0;;
Sorry, but isn't this a little too obvious? As the old saying, the early bird catches the worm.,0,0,0,0,0,0,0,0,0,0,0,0,0,0,0,0,0,0,0,0,0,0,0,0,1,0,0,0;;
[NAME] rolls out of the rack, combs his hair and Dood is ready for National Television.,0,0,0,0,0,0,0,0,0,0,0,0,0,0,0,0,0,0,0,0,0,0,0,0,0,0,0,1;;
"Seriously this ""tastes"" avalanche is gold I'm cracking up,0,0,0,0,0,0,0,0,0,0,0,0,0,0,0,0,0,0,0,0,0,0,0,0,0,0,0,1";;
Yes. Many wedding parties don't know what to do with the ring bear after the vows, so there are many up for adoption.,0,0,0,0,0,0,0,0,0,0,0,0,0,0,0,0,0,0,0,0,0,0,0,0,0,0,0,1;;
This joke has been on here a million times and never ceases to trick me,0,0,0,1,0,0,0,0,0,0,0,0,0,0,0,0,0,0,0,0,0,0,0,0,0,0,0,0;;
OMG this Extreme Love commercial. Yikes.,0,0,0,0,0,0,0,0,0,0,0,0,0,0,0,0,0,0,1,0,0,0,0,0,0,0,1,0;;
