text,admiration,amusement,anger,annoyance,approval,caring,confusion,curiosity,desire,disappointment,disapproval,disgust,embarrassment,excitement,fear,gratitude,grief,joy,love,nervousness,optimism,pride,realization,relief,remorse,sadness,surprise,neutral;;
I'd rather continue throwing money into these foreign sinkholes than use it to mess up the healthcare markets any further.,0,0,1,1,0,0,0,0,0,0,0,1,0,0,0,0,0,0,0,0,0,0,0,0,0,0,0,0;;
Sooner or later you're both going to have to make some choices about your priorities.,0,0,0,0,0,0,0,0,0,0,0,0,0,0,0,0,0,0,0,0,0,0,0,0,0,0,0,1;;
Some of my posts got removed because of rule 1 despite them clearly being about [NAME].,0,0,0,0,0,0,0,0,0,0,0,0,0,0,0,0,0,0,0,0,0,0,1,0,0,0,0,0;;
I have little to no anxiety and it really helps me when i have to take a test.,0,0,0,0,0,0,0,0,0,0,0,0,0,0,0,0,0,1,0,0,0,0,0,1,0,0,0,0;;
Me when I distract the last zombie so my friends can work on the Easter egg without starting the next wave,0,0,0,1,0,0,0,0,0,0,0,0,0,0,0,0,0,0,0,0,0,0,0,0,0,0,0,0;;
I switched to aram/special game modes only and it stays pretty fun.,0,0,0,0,0,0,0,0,0,0,0,0,0,0,0,0,0,0,0,0,0,0,0,0,0,0,0,0;;
.. :< you're welcome ;;,0,0,0,0,0,0,0,0,0,0,0,0,0,0,0,1,0,0,0,0,0,0,0,0,0,0,0,0
yeah you got wooshed way too hard,0,0,0,0,0,0,0,0,0,0,0,0,0,0,0,0,0,0,0,0,0,0,0,0,0,0,0,1;;
CW is available without Cable. But if your saying it doesnÉ??t qualify as broadcast then I guess Kids WB never did,0,0,0,0,0,0,0,0,0,0,0,0,0,0,0,0,0,0,0,0,0,0,0,0,0,0,0,1;;
I just thought I would be remise if I did not engage with the subject.,0,0,0,0,0,0,0,0,0,0,0,0,0,0,0,0,0,0,0,0,0,0,0,0,1,0,0,0;;
What fun is this?? I love it!,0,0,0,0,0,0,0,1,0,0,0,0,0,0,0,0,0,0,1,0,0,0,0,0,0,0,0,0;;
How do you deal with alerts coming up on your phone? I guess you can just turn them off?,0,0,0,0,0,0,1,0,0,0,0,0,0,0,0,0,0,0,0,0,0,0,1,0,0,0,0,0;;
Not really grinding you down though. The EU is just sticking to the agreed schedule,0,0,0,0,0,0,0,0,0,0,0,0,0,0,0,0,0,0,0,0,0,0,0,0,0,0,0,1;;
"Look, [NAME]! I'm a cat. ""Ffs, [NAME]. Get off the ground. You're embarrassing me."",0,0,0,0,0,0,0,0,0,0,0,0,1,0,0,0,0,0,0,0,0,0,0,0,0,0,0,0";;
oh [NAME]...,0,0,0,0,0,0,0,0,0,0,0,0,1,0,0,0,0,0,0,0,0,0,0,0,0,0,0,0;;
Prove it.,0,0,0,0,0,0,0,0,0,0,0,0,0,0,0,0,0,0,0,0,0,0,0,0,0,0,0,0;;
That.. would be glorious. A large one of these would be the NZ equivalent of Giga Pudding.,1,0,0,0,0,0,0,0,0,0,0,0,0,0,0,0,0,0,0,0,0,0,0,0,0,0,0,0;;
Daddy issues [NAME],0,0,0,0,0,0,0,0,0,0,0,0,1,0,0,0,0,0,0,0,0,0,0,0,0,0,0,0;;
As I understand it, the director? left so at least if they do reboot it itÉ??ll be in more competent hands lol,0,1,0,0,0,0,0,0,0,0,0,0,0,0,0,0,0,0,0,0,0,0,0,0,0,0,0,0;;
Any man who wonÉ??t fight for his kids isnÉ??t worth your time.,0,0,0,0,0,0,0,0,0,0,0,0,0,0,0,0,0,0,0,0,0,0,0,0,0,0,0,1;;
If Wacky Races kept on going it would have 100% adult viewers,0,0,0,0,0,0,0,0,0,0,0,0,0,0,0,0,0,0,0,0,1,0,0,0,0,0,0,0;;
Yeah I could definitely see that, which is sad.,0,0,0,0,1,0,0,0,0,0,0,0,0,0,0,0,0,0,0,0,0,0,0,0,0,0,0,0;;
Found the apologist.,0,0,0,1,0,0,0,0,0,0,0,0,0,0,0,0,0,0,0,0,0,0,0,0,0,0,0,0;;
Holy bait-and-switch, [NAME]. IÉ??m so sorry, that has to be incredibly stressful to have to be around and deal with.,0,0,0,0,0,0,0,0,0,0,0,0,0,0,0,0,0,0,0,1,0,0,0,0,0,0,0,0;;
I really donÉ??t want the I told you so moment to ever arrive. –???,0,0,0,1,0,0,0,0,0,0,1,0,0,0,0,0,0,0,0,0,0,0,0,0,0,0,0,0;;
[NAME] is freaking adorable fight me,0,0,0,0,0,0,0,0,0,0,0,0,0,0,0,0,0,0,0,0,0,0,0,0,0,0,0,1;;
A cat has never understood me so well.,0,0,0,0,0,0,0,0,0,1,0,0,0,0,0,0,0,0,0,0,0,0,0,0,0,1,0,0;;
Lmao, they are gonna have field day ,0,0,0,0,0,0,0,0,0,0,0,0,0,0,0,0,0,0,0,0,0,0,0,0,0,0,0,1;;
Dont worry, they are the best surgeons in the hospital and they will remove the tumor in no time,1,0,0,0,0,1,0,0,0,0,0,0,0,0,0,0,0,0,0,0,0,0,0,0,0,0,0,0;;
I hope you'll be feeling better soon, friend,0,0,0,0,0,0,0,0,0,0,0,0,0,0,0,0,0,0,0,0,1,0,0,0,0,0,0,0;;
I was dispointed in 5. it was clearly thrown in to sell 3, as they wanted to make 3 not 5 D. ,0,0,0,0,0,0,0,0,0,1,0,0,0,0,0,0,0,0,0,0,0,0,0,0,0,0,0,0;;
Not gonna lie IÉ??m against offensive chants donÉ??t @ me. I think they are unnecessary and a detriment to the O calling a play,0,0,0,0,0,0,0,0,0,0,0,0,0,0,0,0,0,0,0,0,0,0,0,0,0,0,0,1;;
And...peter thiel is involved. Color me surprised. (O negative surprised that is.),0,0,0,0,0,0,0,0,0,0,0,0,0,0,0,0,0,0,0,0,0,0,0,0,0,0,0,0;;
He hide his tears behind that fedora,0,0,0,0,0,0,0,0,0,0,0,0,0,0,0,0,0,0,0,0,0,0,0,0,0,0,0,1;;
In the end it is just another day surrounded by fake fans. If people wana watch a team that never loses they should stick to NCAAF,0,0,0,0,0,0,0,0,0,0,0,0,0,0,0,0,0,0,0,0,0,0,0,0,0,1,0,0;;
I remember going to the US for the first time as a kid and being utterly fascinated by the cycle of lawyer/prescription drug commercials,0,0,0,0,1,0,0,0,0,0,0,0,0,0,0,0,0,0,0,0,0,0,0,0,0,0,0,0;;
I love crows!!!!,0,0,0,0,0,0,0,0,0,0,0,0,0,0,0,0,0,0,1,0,0,0,0,0,0,0,0,0;;
She tried playing the É??I know a secretÉ?ù game during the hearing. It blew up in her,0,0,0,0,0,0,0,0,0,0,0,0,0,0,0,0,0,0,0,0,0,0,0,0,0,0,0,1;;
Not exactly starving though is it, so my point still stands.,0,0,0,0,0,0,0,0,0,0,1,0,0,0,0,0,0,0,0,0,0,0,0,0,0,0,0,0;;
having a serious relationship is too hard for other people,0,0,1,0,0,0,0,0,0,0,0,0,0,0,0,0,0,0,0,0,0,0,0,0,0,0,0,0;;
IÉ??m sorry, I donÉ??t hear the excuses for harden post season success after he blew two 17 point leads in G6/7. ,0,0,0,0,0,0,0,0,0,0,1,0,0,0,0,0,0,0,0,0,0,0,0,0,0,0,0,0;;
I donÉ??t think [NAME] knocking us out of the copa would change anything. Our team is incredibly lethargic.,0,0,0,0,0,0,0,0,0,1,1,0,1,0,0,0,0,0,0,0,0,0,0,0,0,0,0,0;;
No one wants the wrong person executed for a crime fool,0,0,0,0,0,0,0,0,1,0,0,0,0,0,0,0,0,0,0,0,0,0,0,0,0,0,0,0;;
The BMW had to pee really bad.,0,0,0,0,0,0,0,0,0,0,0,0,0,0,0,0,0,0,0,0,0,0,0,0,0,0,0,1;;
Same! I was like wth was she trying to go for. NOT a good look for her.,0,0,0,0,1,0,0,0,0,0,0,0,0,0,0,0,0,0,0,0,0,0,0,0,0,0,0,0;;
While we watch the private form of Operation Chokepoint with Patreon, it's bizarre that people don't believe this stuff is real. ,0,0,0,0,1,0,0,0,0,0,0,0,0,0,0,0,0,0,0,0,0,0,0,0,0,0,0,0;;
Just think of it as set in an alternate universe where America didnÉ??t just take independence but went back to England and established their own colonies there.,0,0,0,0,0,0,0,0,0,0,0,0,0,0,0,0,0,0,0,0,1,0,0,0,0,0,0,0;;
You literally picked out a blatant left leaning media checker to check the two sites. The irony,0,0,0,1,0,0,0,0,0,0,0,0,0,0,0,0,0,0,0,0,0,0,0,0,0,0,0,0;;
Animal Crossing made my wife into a vicious and abusive murderer.,0,0,1,0,0,0,0,0,0,0,0,0,0,0,0,0,0,0,0,0,0,0,0,0,0,1,0,0;;
I am vuri disappointed in you. You gained turdy pounds tis munt. Scale dont lie,0,0,0,0,0,0,0,0,0,1,0,0,0,0,0,0,0,0,0,0,0,0,0,0,0,0,0,0;;
You got this! Go easy on yourself man..,0,0,1,0,0,1,0,0,0,0,0,0,0,0,0,0,0,0,0,0,0,0,0,0,0,0,0,0;;
[NAME] pays big. He bought out Hot DougÉ??s so he could enjoy their foie gras sausages 4x a day.,0,0,0,0,0,0,0,0,0,0,0,0,0,0,0,0,0,1,0,0,0,0,0,0,0,0,0,0;;
NL West had 3 teams in the playoffs in 2017 and 2 in 2018......wtf you on about,0,0,0,1,0,0,0,1,0,0,0,0,0,0,0,0,0,0,0,0,0,0,0,0,0,0,0,0;;
Holy fuck this thread is not worth it,0,0,0,1,0,0,0,0,0,0,0,0,0,0,0,0,0,0,0,0,0,0,0,0,0,0,0,0;;
Is that her official name now? [NAME],0,1,0,0,0,0,1,0,0,0,0,0,0,0,0,0,0,0,0,0,0,0,0,0,0,0,0,0;;
I'll continue to be dumb for supporting a company I like. Thanks for your input poor.,0,0,0,0,0,0,0,0,0,0,0,0,0,0,0,1,0,0,0,0,0,0,0,0,0,0,0,0;;
Is that a little poot at :09?,0,0,0,0,0,0,1,0,0,0,0,0,0,0,0,0,0,0,0,0,0,0,0,0,0,0,0,0;;
But then she canÉ??t be there for her son due to prison for battery. But it probably would be pretty cathartic,0,0,0,0,0,0,0,0,0,0,0,0,0,0,0,0,0,0,0,0,0,0,0,0,0,0,0,1;;
Bloody Peasant!,0,0,1,0,0,0,0,0,0,0,0,0,0,0,0,0,0,0,0,0,0,0,0,0,0,0,0,0;;
They probably didn't know.,0,0,0,0,0,0,0,0,0,0,0,0,0,0,0,0,0,0,0,0,0,0,0,0,0,0,0,1;;
Much appreciated !,1,0,0,0,0,0,0,0,0,0,0,0,0,0,0,0,0,0,0,0,0,0,0,0,0,0,0,0;;
My new favorite phrase.,0,0,0,0,0,0,0,0,0,0,0,0,0,0,0,0,0,1,0,0,0,0,0,0,0,0,0,0;;
Great! I hope we can make our loan system work better,0,0,0,0,0,0,0,0,0,0,0,0,0,0,0,0,0,0,0,0,1,0,0,0,0,0,0,0;;
Cats can be right-pawed or left-pawed. --- LocationBot 4.31977192 | Report Issues,0,0,0,0,0,0,0,0,0,0,0,0,0,0,0,0,0,0,0,0,0,0,0,0,0,0,0,1;;
Oh...this is the one time... Yes I can assure you none of those outlets print satire without labeling it as satire or opinion,0,0,0,0,0,0,0,0,0,0,0,0,0,0,0,0,0,0,0,0,1,0,0,0,0,0,0,0;;
Marginal propensity to consume is what I have heard. Any consumption tax is going to hurt poor more than rich, it is basic economic 101.,0,0,0,1,0,0,0,0,0,1,0,0,0,0,0,0,0,0,0,0,0,0,0,0,0,0,0,0;;
[NAME], learn some fucking grammar and punctuation. Maybe use some paragraphs. Just an idea.,0,0,0,0,0,0,0,0,0,0,0,1,0,0,0,0,0,0,0,0,0,0,0,0,0,0,0,0;;
Happy Birthday!,0,0,0,0,0,0,0,0,0,0,0,0,0,0,0,0,0,0,0,0,0,0,0,0,0,0,0,1;;
It's not much, but it's honest work.,0,0,0,0,1,0,0,0,0,0,0,0,0,0,0,0,0,0,0,0,0,0,0,0,0,0,0,0;;
The Wildling! He is kissed by fire!,1,0,0,0,0,0,0,0,0,0,0,0,0,0,0,0,0,0,0,0,0,0,0,0,0,0,0,0;;
"I think people feel the need to ""catch up"" to guildmates so they can do end game content together,0,0,0,0,0,0,0,0,0,0,0,0,0,0,0,0,0,0,0,0,0,0,0,0,0,0,0,1";;
Those of us paying attention already knew, but now the normies are noticing.,0,0,0,0,0,0,0,1,0,0,0,0,0,0,0,0,0,0,0,0,0,0,0,0,0,0,0,0;;
> consider another better job Oh believe me I am doing that. But this will have to do for now!,0,0,0,0,0,0,0,0,0,0,0,0,0,0,0,0,0,0,0,0,0,0,0,0,0,0,0,1;;
For as long as sheÉ??s been gone, IÉ??m terrified to think why she was kept alive that long.,0,0,0,0,0,0,0,0,0,0,0,0,0,0,0,0,0,0,0,0,0,0,1,0,0,0,0,0;;
Oooh that's so sweet,she sounds like a good and caring mother. Does your dad know?,1,0,0,0,0,1,0,0,0,0,0,0,0,0,0,0,0,0,0,0,0,0,0,0,0,0,0,0;;
IÉ??m only denying whatÉ??s not true, and [NAME] being my name isnÉ??t true. ,0,0,0,0,0,0,0,0,0,1,0,0,0,0,0,0,0,0,0,0,0,0,0,0,0,0,0,0;;
Battlefront 2 could be a horror game,0,0,0,0,0,0,0,0,0,0,0,0,0,0,0,0,0,0,0,0,0,0,0,0,0,0,0,1;;
I don't think you can really go wrong with any of them, but I would suggest to watch him against South Carolina this year.,0,0,0,0,0,0,0,0,0,0,0,0,0,0,0,0,0,0,0,0,1,0,0,0,0,0,0,0;;
Wish this applied to TPS's,0,0,0,0,0,0,0,0,1,0,0,0,0,0,0,0,0,0,0,0,0,0,0,0,0,0,0,0;;
So now itÉ??s a habit to live in a country without a running government I guess!,0,0,0,0,1,0,0,0,0,0,0,0,0,0,0,0,0,0,0,0,0,0,0,0,0,0,0,0;;
I watch it every time I see it posted. There's something beautiful about watching someone so passionate and excited about what they've discovered :),0,0,0,0,1,0,0,0,0,0,0,0,0,0,0,0,0,0,0,0,0,0,0,0,0,0,0,0;;
Think many people misunderstood your intentions here and the conversation just went on a tangent from there.,0,0,0,0,0,0,0,0,0,0,0,0,0,0,0,0,0,0,0,0,0,0,0,0,0,0,0,1;;
He only accepted [NAME] challenges because he never beat him decisively. [NAME] on the other hand...,0,0,0,0,0,0,0,0,0,0,0,0,0,0,0,0,0,0,0,0,0,0,0,0,0,0,0,1;;
I am sure the men here who have Career [NAME] and Supermodel [NAME] fighting over him will appreciate this sage advice.,0,0,0,0,0,0,0,0,0,0,0,0,0,0,0,1,0,0,0,0,0,0,0,0,0,0,0,0;;
Drives to work, realizes its a holiday because nobody answers their phones. Still stuck at work... nothing to do. We dont get paid holidays :(,0,0,0,1,0,0,0,0,0,1,0,0,0,0,0,0,0,0,0,0,0,0,0,0,0,0,0,0;;
I mean.....I know far more people who dabble with things like alchohol, weed and psychedelics than I know who are weekend warriors with opiates....,0,0,0,0,0,0,0,0,0,0,0,0,0,0,0,0,0,0,0,0,0,0,0,0,0,0,0,1;;
The Iowa State Cyclones are my favorite college basketball team.,1,0,0,0,0,0,0,0,0,0,0,0,0,0,0,0,0,0,0,0,0,0,0,0,0,0,0,0;;
itÉ??s a sensitive topic and she probably took it as if smelling bad lol. iÉ??d just avoid saying that,0,1,0,0,0,0,0,0,0,0,0,0,0,0,0,0,0,0,0,0,0,0,0,0,0,0,0,0;;
All of Leviticus is wonderful and interesting. (But I do get the point you are making).,1,0,0,0,0,0,0,0,0,0,0,0,0,0,0,0,0,0,0,0,0,0,0,0,0,0,0,0;;
Wasn't that just a mass shooting? Or am I thinking of another college massacre?,0,0,0,0,0,0,0,1,0,0,0,0,0,0,0,0,0,0,0,0,0,0,0,0,0,0,0,0;;
Omg like I get so moody when I'm hungry lol im so bipolar Yyyeeaaahhhh...,0,1,0,0,0,0,0,0,0,0,0,0,0,0,0,0,0,0,0,0,0,0,0,0,0,0,0,0;;
Happy cake day by the way!,0,0,0,0,0,0,0,0,0,0,0,0,0,1,0,0,0,0,0,0,0,0,0,0,0,0,0,0;;
Then check out their full line! You can be offended by all their herring names!,0,0,0,0,0,0,0,0,0,0,0,0,0,0,0,0,0,0,0,0,0,0,0,0,0,0,0,1;;
to stop any confusion we're talking about this photo,0,0,0,0,0,0,1,0,0,0,0,0,0,0,0,0,0,0,0,0,0,0,0,0,0,0,0,0;;
But what is with that shirt?,0,0,0,0,0,0,0,0,0,0,0,0,0,0,0,0,0,0,0,0,0,0,0,0,0,0,0,1;;
Hallelujah!!!!!,0,0,0,0,0,0,0,0,0,0,0,0,0,0,0,0,0,0,0,0,0,0,0,0,0,0,0,1;;
Is that not common in your area? I see amish people all the time,0,0,0,0,0,0,0,0,0,0,0,1,0,0,0,0,0,0,0,0,0,0,0,0,0,0,0,0;;
I have a 4.95 rating and it did not go down after tonight's riders. Everybody I drove was a talkative l, drunk and merry group.,0,0,0,0,0,0,0,0,0,0,0,0,0,0,0,0,0,0,0,0,0,0,0,0,0,0,0,1;;
Hopefully you get a good bashing soon,0,0,1,0,0,0,0,0,0,0,0,0,0,0,0,0,0,0,0,0,0,0,0,0,0,0,0,0;;
Seems fun, wonder how she would have ended up if the ca er was not there,0,1,0,0,0,0,0,0,0,0,0,0,0,0,0,0,0,0,0,0,0,0,0,0,0,0,0,0;;
hahahaha. Love it,0,0,0,0,0,0,0,0,0,0,0,0,0,0,0,0,0,0,1,0,0,0,0,0,0,0,0,0;;
I'm proud, Reddit. This is a big deal to a fan. I'm genuinely happy for him. ,0,0,0,0,0,0,0,0,0,0,0,0,0,0,0,0,0,1,0,0,0,1,0,0,0,0,0,0;;
Animal Crossing made my wife into a vicious and abusive murderer.,0,0,0,0,0,0,0,0,0,0,1,0,0,0,1,0,0,0,0,0,0,0,0,0,0,0,0,0;;
i'm really disappointed this isn't a real sub because i know there are soo many good notes to go in there,1,0,0,0,1,0,0,0,0,1,0,0,0,0,0,0,0,0,0,0,0,0,0,0,0,0,0,0;;
What a loser, sad. ,0,0,0,0,0,0,0,0,0,0,0,0,0,0,0,0,0,0,0,0,0,0,0,0,0,1,0,0;;
You beat me to it,0,0,0,0,0,0,0,0,0,0,0,0,0,0,0,0,0,0,0,0,0,0,0,0,0,0,0,1;;
Why did you expect to feel comfortable? What have you done to change?,0,0,0,0,0,0,1,1,0,0,0,0,0,0,0,0,0,0,0,0,0,0,0,0,0,0,0,0;;
He has no side of the story or we would have heard it already.,0,0,0,0,0,0,0,0,0,0,0,0,0,0,0,0,0,0,0,0,0,0,0,0,0,0,0,1;;
Habs-Flames has always been my dream final. Right our last wrong.,0,0,0,0,0,0,0,0,0,0,0,0,0,0,0,0,0,0,0,0,0,0,0,0,0,0,0,1;;
YES YES YES VERY EPIC,0,0,0,0,1,0,0,0,0,0,0,0,0,0,0,0,0,0,0,0,0,0,0,0,0,0,0,0;;
 thanks bot! You too man!......Soooooo, what does YOUR hair look like?....,0,0,0,0,0,0,0,0,0,0,0,0,0,0,0,1,0,0,0,0,0,0,0,1,0,0,0,0;;
So you don't reject your ideology's premise that you can just protect yourself.,0,0,0,0,0,1,0,0,0,0,0,0,0,0,0,0,0,0,0,0,0,0,0,0,0,0,0,0;;
iÉ??m sorry i donÉ??t have the box with me,0,0,0,0,0,0,0,0,0,0,0,0,0,0,0,0,0,0,0,0,0,0,0,0,0,1,0,0;;
Maybe because those are real, tangible things and not lines of code,0,0,0,0,1,0,0,0,0,0,0,0,0,0,0,0,0,0,0,0,0,0,1,0,0,0,0,0;;
É??[NAME], I tried to make ramen in the coffee pot and I broke everythingÉ?ù - [NAME],0,0,0,0,0,0,0,0,0,1,0,0,0,0,0,0,0,0,0,0,0,0,0,0,0,0,0,0;;
All I can say is.. good luck bro,0,0,0,0,0,0,0,0,0,0,0,0,0,0,0,0,0,0,0,0,1,0,0,0,0,0,0,0;;
Okay, a little confusion. Why are those É??dÉ?ùs not cancelling out? Edit :skittle-a little,0,0,0,0,0,0,0,1,0,0,0,0,0,0,0,0,0,0,0,0,0,0,1,0,0,0,0,0;;
But according to [NAME] [NAME] didnÉ??t use a phone to contact [NAME], right? Also, Oct 5?,0,0,0,0,0,0,0,0,0,0,0,0,0,0,0,0,0,0,0,0,0,0,0,0,0,0,0,1;;
WhatÉ??s not true, exactly? That population differences affect influence? That politicians know where their voters are and play to those strengths? ,0,0,0,0,0,0,0,0,0,0,0,0,0,0,0,0,0,0,0,0,0,0,0,0,0,0,0,1;;
Of course it is. If it's called #bellletstalk. Not #letstalk.,0,0,0,0,1,0,0,0,0,0,0,0,0,0,0,0,0,0,0,0,0,0,0,0,0,0,0,0;;
Happy birthday, [NAME]!,0,0,0,0,0,0,0,0,0,0,0,0,0,0,0,0,0,1,0,0,0,0,0,0,0,0,0,0;;
No real man would allow his woman to be even looked at by someone else, let alone allow another man to have sex with her,0,0,0,0,0,0,0,0,0,0,0,0,0,0,0,0,0,0,0,0,0,0,0,0,0,0,0,1;;
We had fantastic spacing that possession. Clearing all the defenders to the left side of the court so that [NAME] had a completely open lane to the basket.,1,0,0,0,0,0,0,0,0,0,0,0,0,0,0,0,0,0,0,0,0,0,0,0,0,0,0,0;;
SC is still the only game that makes mt entire body overheat to the point of death.,0,0,0,0,0,0,0,0,0,0,0,0,0,0,1,0,0,0,0,0,0,0,0,0,0,0,0,0;;
I think this divorce is planned so that people will stop pointing fingers at the insane rich person robbing the wealth of the people.,0,0,0,0,0,0,0,0,0,0,0,0,0,0,0,0,0,0,0,0,0,0,0,0,0,0,0,1;;
I cringe when I see [NAME] playing while weÉ??re stuck with sensitive old [NAME].,0,0,0,0,0,0,0,0,0,0,0,0,0,0,1,0,0,0,0,0,0,0,0,0,0,0,0,0;;
yup today hit me extra hard since im unemployed. i feel like im not meant to work, or meant to do anything really!,0,0,0,0,0,0,0,0,0,1,0,0,0,0,0,0,0,0,0,0,0,0,0,0,0,0,0,0;;
Minarchists cant be socialists. This doesn't apply to you brosky.,0,0,0,0,0,0,0,0,0,0,0,0,0,0,0,0,0,0,0,0,0,0,0,0,0,0,0,1;;
Holy shit. Thank you everyone. Thanks for the gold and silver :),0,0,0,0,0,0,0,0,0,0,0,0,0,0,0,1,0,0,0,0,0,0,0,0,0,0,0,0;;
They need a speedy guy to fish pucks.. Either get nylander or Hyman on that line.. [NAME] line deployment is brutal..,0,0,0,0,0,0,0,0,0,0,0,0,0,0,0,0,0,0,0,0,0,0,0,0,0,0,0,1;;
It looks fun as hell too, from what I can tell. IÉ??d love to give it a whirl,0,0,0,0,0,0,0,0,0,0,0,0,0,1,0,0,0,0,0,0,0,0,0,0,0,0,0,0;;
Ok what other characters is her gameplay similar to?,0,0,0,0,0,0,0,1,0,0,0,0,0,0,0,0,0,0,0,0,0,0,0,0,0,0,0,0;;
She started off with 'can't give it up that easily' Op is stuck with her until one of them have expired!!,0,0,0,0,0,0,0,0,0,0,0,0,0,0,0,0,0,0,0,0,0,0,0,0,0,0,0,1;;
This sounds like the kind of comment my weird uncle would leave on my Facebook post.,0,0,0,0,0,0,0,0,0,0,0,1,0,0,0,0,0,0,0,0,0,0,0,0,0,0,0,0;;
Why is the waitress posting here?,0,0,0,0,0,0,0,1,0,0,0,0,0,0,0,0,0,0,0,0,0,0,0,0,0,0,0,0;;
Can you go see her in person?,0,0,0,0,0,0,0,1,0,0,0,0,0,0,0,0,0,0,0,0,0,0,0,0,0,0,0,0;;
Amen! However, see my post about the problem with drafting [NAME]. If we do, [NAME] will probably be the odd man out.,0,0,0,0,0,0,0,0,0,0,0,0,0,0,0,0,0,0,0,0,0,0,0,0,0,0,0,1;;
Hey, thanks for clarifying. I was trying to find news online without any luck.,0,0,0,0,1,0,0,0,0,0,0,0,0,0,0,1,0,0,0,0,0,0,0,0,0,0,0,0;;
ItÉ??s very difficult for men to have platonic friendships with women. Unfortunately itÉ??s just part of life.,0,0,0,0,0,0,0,0,0,0,0,0,0,0,0,0,0,0,0,0,0,0,0,0,0,1,0,0;;
They could've added two dots and a line and it could have been better,0,0,0,0,0,0,0,0,0,0,0,0,0,0,0,0,0,0,0,0,0,0,0,0,0,0,0,1;;
ItÉ??s beautiful. I think I need to move. –???,1,0,0,0,0,0,0,0,0,0,0,0,0,0,0,0,0,0,0,0,1,0,0,0,0,0,0,0;;
I'm a poker pro I'm a pro at my job so I can lose money at poker,0,0,0,0,0,0,0,0,0,0,0,0,0,0,0,0,0,0,0,0,0,0,1,0,0,0,0,0;;
He was credited in commentaries as the inspiration for Cletus. I always loved the way he just wants that dog.,0,0,0,0,0,0,0,0,0,0,0,0,0,0,0,0,0,0,1,0,0,0,0,0,0,0,0,0;;
Oh my gosh. This woman who died also had a son who died. Holy tragedy,0,0,0,0,0,0,0,0,0,0,0,0,0,0,0,0,0,0,0,0,0,0,0,0,0,0,1,0;;
Unfortunate for him, but I'm bringing up players. >AND they can just stop being a support.,0,0,0,0,0,0,0,0,0,0,0,0,0,0,0,0,0,0,0,0,0,0,0,0,0,0,0,1;;
I'm not covering for anybody, trump included.,0,0,0,0,0,0,0,0,0,0,1,0,0,0,0,0,0,0,0,0,0,0,0,0,0,0,0,0;;
Much religion in science??,0,0,0,0,0,0,0,1,0,0,0,0,0,0,0,0,0,0,0,0,0,0,0,0,0,0,0,0;;
209 comments and we donÉ??t get to read any? All that good pasta advice going to waste. Shame.,0,0,0,0,0,0,0,1,0,0,0,0,0,0,0,0,0,0,0,0,0,0,0,0,0,0,0,0;;
Yeah, and [NAME] is not the guy he initially accused of murder. I'm not sure what the confusion is here,0,0,0,0,0,0,0,1,0,0,0,0,0,0,0,0,0,0,0,0,0,0,0,0,0,0,0,0;;
suck me beautiful,1,0,0,0,0,0,0,0,0,0,0,0,0,0,0,0,0,0,0,0,0,0,0,0,0,0,0,0;;
She hasn't even fully moved out yet and I feel the same way. I'm sorry. I know how awful it feels.,0,0,0,0,0,0,0,0,0,0,0,1,0,0,0,0,0,0,0,0,0,0,0,0,0,0,0,0;;
There is a startling lack of empathy in this thread.,0,0,0,0,0,0,0,0,0,0,0,0,0,0,0,0,0,0,0,0,0,0,0,0,0,0,1,0;;
Class topper meant something way different when I was growing up lol,0,1,0,0,0,0,0,0,0,0,0,0,0,0,0,0,0,0,0,0,0,0,0,0,0,0,0,0;;
Think of how long you can park!,0,0,0,0,0,0,0,0,0,0,0,0,0,0,0,0,0,0,0,0,0,0,0,0,0,0,0,1;;
yep, you don't hate Mondays, you hate capitalism. ,0,0,0,0,0,0,0,0,0,0,0,0,0,0,0,0,0,0,0,0,0,0,0,0,0,0,0,1;;
My new favorite phrase.,1,0,0,0,0,0,0,0,0,0,0,0,0,0,0,0,0,0,0,0,0,0,0,0,0,0,0,0;;
Not gonna lie. Sucked out a few, but am really trying to analyze my play afterwards. Thanks!,0,0,0,0,0,0,0,0,0,0,0,0,0,0,0,1,0,0,0,0,0,0,0,0,0,0,0,0;;
I always wondered how testicles sound when popping.... hoping that it would never happen to me.,0,0,0,0,0,0,0,0,0,0,0,0,0,0,0,0,0,0,0,0,0,0,0,0,0,0,1,0;;
Thank You, that does seem to be the consensus. ,0,0,0,0,1,0,0,0,0,0,0,0,0,0,0,1,0,0,0,0,0,0,0,0,0,0,0,0;;
I have never seen a curly haired cat! TIL,0,0,0,0,0,0,0,0,0,0,0,0,0,0,0,0,0,0,0,0,0,0,0,0,0,0,0,1;;
Wat u been ordering u naughty boy–???,0,0,0,0,0,0,0,0,0,0,0,0,0,0,0,0,0,0,0,0,0,0,0,0,0,0,0,0;;
That survival rate is skewed. It doesn't include the people who don't seek treatment because they can't afford it,0,0,0,0,0,0,0,0,0,0,0,0,0,0,0,0,0,0,0,0,0,0,0,0,0,0,0,1;;
ShouldnÉ??t have told them how much they cost, as they advised they knew they were expensive and that it was ok. ,0,0,0,0,0,0,0,0,0,0,0,0,0,0,0,0,0,0,0,0,0,0,0,0,0,0,0,1;;
I'm sorry. I wish I could give you more hopeful answers.,0,0,0,0,0,0,0,0,0,0,0,0,0,0,0,0,0,0,0,0,0,0,0,0,1,1,0,0;;
YouÉ??re doing so good! WeÉ??re all so proud!,1,0,0,0,0,0,0,0,0,0,0,0,0,0,0,0,0,0,0,0,0,1,0,0,0,0,0,0;;
I went there once and was like É??yeah neat I guessÉ?ù around the same time. Totally forgot about it until I saw the pic of the door,0,0,0,0,0,0,0,0,0,0,0,0,0,0,0,0,0,0,0,0,0,0,1,0,0,0,0,0;;
That's sad. I'm 16 and where I am there are loads of athiests my age. It's great.,1,0,0,0,0,1,0,0,0,0,0,0,0,0,0,0,0,0,0,0,0,0,0,0,0,0,0,0;;
Burnout takedown. Then when trying to recover in the weekend, a nice chunk of self condemnation.,0,0,0,1,0,0,0,0,0,1,1,0,0,0,0,0,0,0,0,0,0,0,0,0,0,0,0,0;;
That must have bean awesome to find those,0,0,0,0,0,0,0,0,0,0,0,0,0,0,0,0,0,1,0,0,0,0,0,0,0,0,0,0;;
I am not having a great day either. Sending good vibes, hope you feel better :),0,0,0,0,0,1,0,0,0,0,0,0,0,0,0,0,0,0,0,0,0,0,0,0,0,0,0,0;;
Based on that cars wheels it is now very tired.,0,0,0,0,1,0,0,0,0,0,0,0,0,0,0,0,0,0,0,0,0,0,0,0,0,0,0,0;;
Im looking for this, but I predict a 3-1 win to bar«ıa. I really hope [NAME] doesnt bore me,0,0,0,0,0,0,0,0,0,0,0,0,0,0,0,0,0,0,0,0,1,0,0,0,0,0,0,0;;
I'm surprised that the police have not send her to a mental institution,0,0,0,0,0,0,0,0,0,0,0,0,0,0,0,0,0,0,0,0,0,0,0,0,0,0,1,0;;
Well no matter what her bio says, if you are ugly, you are done for. ,0,0,0,0,1,0,0,0,0,0,0,0,0,0,0,0,0,0,0,0,0,0,0,0,0,0,0,0;;
Paraphrasing [NAME], this brought warm feelings to my heart.,0,0,0,0,0,0,0,0,0,0,0,0,0,0,0,0,0,1,0,0,0,0,0,0,0,0,0,0;;
Oh and I forgot to add: he doesn't take your money and become a financial burden on your life,0,0,0,0,1,0,0,0,0,0,0,0,0,0,0,0,0,0,0,0,0,0,0,0,0,0,0,0;;
Been a weeb for yrs and i still cant understand besides a few phrases,0,0,0,0,0,0,1,0,0,0,0,0,0,0,0,0,0,0,0,0,0,0,0,0,0,0,0,0;;
I think the driver had the heart attack. She did not even give him a wave and a thank you for not smashing her precious child.,0,0,0,0,0,0,0,0,0,0,0,0,0,0,0,1,0,0,0,0,0,0,0,0,0,0,0,0;;
[NAME] will need to pray to The [NAME] dad doesnÉ??t come down on him with great vengeance.,0,0,0,1,0,0,0,0,0,0,0,0,0,0,0,0,0,0,0,0,0,0,0,0,0,0,0,0;;
You might enjoy this,0,1,0,0,0,0,0,0,0,0,0,0,0,0,0,0,0,0,0,0,0,0,0,0,0,0,0,0;;
Didn't u just say ur new to this? Why are you speaking?,0,0,0,1,0,0,0,0,0,0,0,0,0,0,0,0,0,0,0,0,0,0,0,0,0,0,1,0;;
Man your post really struck me I feel exactly the same way you do. IÉ??m tired and I feel like itÉ??s too much work.,0,0,0,0,0,0,0,0,0,0,0,0,0,0,0,0,0,0,0,0,0,0,0,0,0,0,0,1;;
Happy cake day man,0,0,0,0,0,0,0,0,0,0,0,0,0,0,0,0,0,0,0,0,1,0,0,0,0,0,0,0;;
I found the love of my life at 35. There's plenty of time.,0,0,0,0,0,0,0,0,0,0,0,0,0,0,0,0,0,0,0,0,0,0,0,0,0,0,0,1;;
Damn, thanks for the source!,0,0,0,0,0,0,0,0,0,0,0,0,0,0,0,1,0,0,0,0,0,0,0,0,0,0,0,0;;
Yeah, but the thing is that I did send them. Therefore, I donÉ??t have them, and havenÉ??t for months.,0,0,0,0,0,0,0,0,0,0,1,0,0,0,0,0,0,0,0,0,0,0,0,0,0,0,0,0;;
Yes, we do. One with very misguided priorities,0,0,0,0,0,0,0,0,0,0,0,0,1,0,0,0,0,0,0,0,0,0,0,0,0,0,0,0;;
Now I know rhino poop is very green.,0,0,0,0,0,0,0,0,0,0,0,0,0,0,0,0,0,0,0,0,0,0,0,0,0,0,0,1;;
$20k - $30k is not an unrealistic sum. It would cost that much and more just to sell or house.,0,0,0,0,0,0,0,0,0,0,1,0,0,0,0,0,0,0,0,0,0,0,0,0,0,0,0,0;;
You sound like a great mum,0,0,0,0,1,0,0,0,0,0,0,0,0,0,0,0,0,0,0,0,0,0,0,0,0,0,0,0;;
Meanwhile I came in to a clinic the other week with a swollen toe and left with *codeine*.,0,0,0,0,0,0,0,0,0,0,0,0,0,0,0,0,0,0,0,0,0,0,0,0,0,0,0,1;;
Your comment is completely irrelevant and you're trolling me in order for you to cry and whine about Detroit. Get out of here.,0,0,1,0,0,0,0,0,0,0,0,0,0,0,0,0,0,0,0,0,0,0,0,0,0,0,0,0;;
I don't think WI is lean red, after 2018 I'd argue for it being either tossup or lean blue.,0,0,0,0,0,0,0,0,0,0,1,0,0,0,0,0,0,0,0,0,0,0,0,0,0,0,0,0;;
