text,admiration,amusement,anger,annoyance,approval,caring,confusion,curiosity,desire,disappointment,disapproval,disgust,embarrassment,excitement,fear,gratitude,grief,joy,love,nervousness,optimism,pride,realization,relief,remorse,sadness,surprise,neutral;;
You know what they say, when everyone around you is and asshole, maybe it's you who is the asshole.,0,0,0,1,0,0,0,0,0,0,0,0,0,0,0,0,0,0,0,0,0,0,0,0,0,0,0,0;;
isn't a different model for [NAME]?,0,0,0,0,0,0,1,0,0,0,0,0,0,0,0,0,0,0,0,0,0,0,0,0,0,0,0,0;;
Cool have fun,0,1,0,0,0,0,0,0,0,0,0,0,0,0,0,0,0,0,0,0,0,0,0,0,0,0,0,0;;
I think you are missing: He's learned from the experiences and has stopped acting that way.,0,0,0,0,0,0,0,0,0,0,0,0,0,0,0,0,0,0,0,0,0,0,0,0,0,0,0,1;;
"Aw man I thought you liked ""Forgoing the Playoffs"",0,0,0,0,0,0,0,0,0,1,0,0,0,0,0,0,0,0,0,0,0,0,0,0,0,0,0,0";;
What an ugly shade [NAME] used to dye his hair. Well, I guess it matches the infamous shirt.,0,0,0,1,0,0,0,0,0,0,0,0,0,0,0,0,0,0,0,0,0,0,0,0,0,0,0,0;;
Was it just me or when they showed the backboard camera did the hoop look like it had a surprised face?,0,0,0,0,0,0,0,0,0,0,0,0,0,0,0,0,0,0,0,0,0,0,0,0,0,0,1,0;;
Hungry hungry hungry,0,0,0,0,0,0,0,0,0,0,0,0,0,0,0,0,0,0,0,0,0,0,0,0,0,0,0,0;;
I see you're a man of culture as well. But realistically this will never happen because... Disney :/,0,0,0,0,1,0,0,0,0,0,0,0,0,0,0,0,0,0,0,0,0,0,0,0,0,0,0,0;;
You made yourself useless playing their game instead of forcing them to play to your strengths,0,0,0,1,0,0,0,0,0,0,0,0,0,0,0,0,0,0,0,0,0,0,0,0,0,0,0,0;;
I just had a panic attack!,0,0,0,0,0,0,0,0,0,0,0,0,0,0,1,0,0,0,0,0,0,0,0,0,0,0,0,0;;
It would be good if the producers can find a carrot to dangle that can get these idiots to spill on each other.,1,0,0,0,0,0,0,0,0,0,0,0,0,0,0,0,0,0,0,0,0,0,0,0,0,0,0,0;;
Interesting to see the bulk of people in that thread are pretty anti-[RELIGION].,1,0,0,0,0,0,0,0,0,0,0,0,0,0,0,0,0,0,0,0,0,0,0,0,0,0,0,0;;
I can do that too but I have diarrhea,0,0,0,0,1,0,0,0,0,1,0,0,0,0,0,0,0,0,0,0,0,0,0,0,0,1,0,0;;
I get a kink in my neck from brushing my hair damn,0,0,0,0,0,0,0,0,0,0,0,0,0,0,0,0,0,0,0,0,0,0,0,0,0,0,0,1;;
Seriously. [NAME] is a hero. I heard he was a volunteer firefighter during 9/11.,1,0,0,0,0,0,0,0,0,0,0,0,0,0,0,0,0,0,0,0,0,0,0,0,0,0,0,0;;
Wow, that's just incredibly racist.,1,0,0,0,0,0,0,0,0,0,0,0,0,1,0,0,0,0,0,0,0,0,0,0,0,0,0,0;;
Exactly. Some ammo is already cheaper than that.,0,0,0,1,0,0,0,0,0,0,0,0,0,0,0,0,0,0,0,0,0,0,0,0,0,0,0,0;;
Ah thanks –??ç–?èØ,0,0,0,0,0,0,0,0,0,0,0,0,0,0,0,0,0,0,0,0,0,0,0,0,0,0,0,1;;
I'd be a lot more excited to see [NAME] flash the leather at 3b.,0,0,0,0,0,0,0,0,0,0,0,0,0,1,0,0,0,0,0,0,0,0,0,0,0,0,0,0;;
Adding a few projectile characters only made the game better, not worse. Bars can go though.,0,0,0,0,1,0,0,0,0,0,0,0,0,0,0,0,0,0,0,0,0,0,0,0,0,0,0,0;;
I'm terrible sorry, /u/bookluvr83, but I'm afraid I must join up with the giving-you-crap-for-not-liking-brownies bandwagon. ^kidding ^^^kinda,0,0,0,0,0,0,0,0,0,0,0,0,0,0,1,0,0,0,0,0,0,0,0,0,1,0,0,0;;
Well, only the fringe dissipates into the ether. ,0,0,0,0,0,0,0,0,0,0,0,0,0,0,0,0,0,0,0,0,0,0,0,0,0,0,0,1;;
You mean I shouldn't be doing treating it that way now?,0,0,0,0,0,0,0,0,0,0,0,0,0,0,0,0,0,0,0,0,0,0,0,0,0,0,0,1;;
Chicken and the egg argument. Gun companies don't donate to [NAME] *because* they have gun control on their platform. This goes back decades mind you.,0,0,0,0,0,0,0,0,0,0,0,0,0,0,0,0,0,0,0,0,0,0,0,0,0,0,0,1;;
You hang your head in shame. Not because of this, but just in general.,0,0,1,0,0,0,0,0,0,1,0,0,1,0,0,0,0,0,0,0,0,0,0,0,0,0,0,0;;
You guys really took this loss well. I'm stunned at how not-salty you minor leaguers are taking it. Totally not full of excuses and what-ifs.,1,0,0,0,0,0,0,0,0,0,0,0,0,0,0,0,0,0,0,0,0,0,0,0,0,0,0,0;;
I honestly hope you do that,0,0,0,0,0,0,0,0,0,0,0,0,0,0,0,0,0,0,0,0,1,0,0,0,0,0,0,0;;
im not talking about a studio. im talking about *people*. people that you're lying about, because you're an uninformed yet arrogant, entitled child.,0,0,0,0,0,0,0,0,0,0,0,1,0,0,0,0,0,0,0,0,0,0,0,0,0,0,0,0;;
What you fiend!!!!! But seriously, how do these guys feel about animals fucking then?,0,0,0,0,0,0,0,0,0,0,0,0,0,0,0,0,0,0,0,0,0,0,0,0,0,0,0,1;;
The difference between the two to the right is quite massive.,0,0,0,0,0,0,0,0,0,0,1,0,0,0,0,0,0,0,0,0,0,0,0,0,0,0,0,0;;
Nah, they're a fraction as immature and petulant as the politician we can't ignore that actually affects our lives.,0,0,1,1,0,0,0,0,0,0,0,0,0,0,0,0,0,0,0,0,0,0,0,0,0,0,0,0;;
I found that after particularly bad games I feel the É??needÉ?ù to smoke more weed, like a cigarette after a carcrash IMO,0,0,0,0,0,0,0,0,1,0,0,0,0,0,0,0,0,0,0,0,0,0,0,0,0,0,0,0;;
which grind gives you the right to cheat on your girlfriend ? lmao,0,0,0,0,0,0,0,0,0,0,0,0,0,0,0,0,0,0,0,0,0,0,0,0,0,0,0,1;;
Keep watching!,0,0,0,0,0,0,0,0,0,0,0,0,0,1,0,0,0,0,0,0,0,0,0,0,0,0,0,0;;
Growing up in Chicago this was my life. Pissed he didnÉ??t make it.,0,0,0,0,0,0,0,0,0,0,0,0,0,0,0,0,0,0,0,0,0,0,0,0,0,0,0,1;;
Reported again :),0,0,0,0,0,0,0,0,0,0,0,0,0,0,0,0,0,0,0,0,0,0,0,0,0,0,0,1;;
I'd rather have [NAME]. Killing her off was a waste.,0,0,0,1,0,0,0,0,0,0,0,0,0,0,0,0,0,0,0,0,0,0,0,0,0,0,0,0;;
"I THOUGHT IT WAS ""PRESS GANGING"" WHERE THEY WOULD RANDOMLY GRAB YOUNG BOYS OFF THE STREETS OF ENGLAND AND FORCE THEM TO SERVE IN THE ROYAL NAVY?,0,0,0,0,0,0,0,0,0,0,0,0,0,0,0,0,0,0,0,0,0,0,0,0,0,0,0,1";;
The father clearly ran away lol,0,0,0,0,0,0,0,0,0,0,0,0,0,0,0,0,0,0,0,0,0,0,0,0,0,0,0,1;;
Great, now I look dumber than I normally am,1,0,0,0,0,0,0,0,0,0,0,0,0,0,0,0,0,0,0,0,0,0,0,0,0,0,0,0;;
In just 1 Year the user who posted this got a lot of karma... interesting...,0,0,0,0,0,0,0,1,0,0,0,0,0,0,0,0,0,0,0,0,0,0,0,0,0,0,0,0;;
This again?,0,0,0,0,0,0,0,0,0,0,0,0,0,0,0,0,0,0,0,0,0,0,0,0,0,0,0,1;;
I would have liked this period to go differently.,0,0,0,0,0,0,0,0,0,0,0,0,0,0,0,0,0,0,0,0,0,0,0,0,0,0,0,1;;
Lips are the key to crumb containment.,0,0,0,0,0,0,0,0,0,0,0,0,0,0,0,0,0,0,0,0,0,0,0,0,0,0,0,1;;
What a nice [NAME] sentiment!,1,0,0,0,1,0,0,0,0,0,0,0,0,0,0,0,0,0,0,0,0,0,0,0,0,0,1,0;;
Care to explain?,0,0,0,0,0,0,0,0,0,0,0,0,0,0,0,0,0,0,0,0,0,0,0,0,0,0,0,1;;
Well, the [NAME] should help us out, the reason we are in this political mess is because we detained a person for them. ,1,0,0,0,1,0,0,0,0,0,0,0,0,0,0,0,0,0,0,0,0,0,0,0,0,0,0,0;;
Not sure, what organization? How deep are you certified for? Most shops are PADI, but you can cross over easily.,0,0,0,0,0,0,1,1,0,0,0,0,0,0,0,0,0,0,0,0,0,0,0,0,0,0,0,0;;
I see him doing that.,0,0,0,0,1,0,0,0,0,0,0,0,0,0,0,0,0,0,0,0,0,0,0,0,0,0,0,0;;
Cheese cave time,0,0,0,0,0,0,0,0,0,0,0,0,0,0,0,0,0,0,0,0,0,0,0,0,0,0,0,1;;
If youÉ??re you and comfortable, you go, girl. ,1,0,0,0,1,0,0,0,0,0,0,0,0,0,0,0,0,0,0,0,0,0,0,0,0,0,0,0;;
Why not both? It would reduce crime. Significantly,0,0,0,0,0,0,0,1,0,0,0,0,0,0,0,0,0,0,0,0,0,0,0,0,0,0,0,0;;
Wonderful :D, she looks like [NAME] from Frozen, or [NAME] form Dota 2. Great job!,1,0,0,0,0,0,0,0,0,0,0,0,0,0,0,0,0,0,0,0,0,0,0,0,0,0,0,0;;
Isn't this kind of what America is all about,0,0,0,0,0,0,0,0,0,0,0,0,0,0,0,0,0,0,0,0,0,0,0,0,0,0,0,1;;
And how long ago was this?,0,0,0,0,0,0,0,1,0,0,0,0,0,0,0,0,0,0,0,0,0,0,0,0,0,0,0,0;;
She later drunkenly slipped on her puddle, fell onto the tracks, and was run over. RIP,0,0,0,0,0,0,0,0,0,0,0,0,0,0,0,0,1,0,0,0,0,0,0,0,0,1,0,0;;
That son of a bitch!,0,0,1,1,0,0,0,0,0,0,0,0,0,0,0,0,0,0,0,0,0,0,0,0,0,0,0,0;;
I have no idea what that even means nor why you're being such a massive prick,0,0,0,0,0,0,0,0,0,0,0,0,1,0,0,0,0,0,0,0,0,0,0,0,0,0,0,0;;
Shut up 15 year-old,0,0,1,1,0,0,0,0,0,0,0,0,0,0,0,0,0,0,0,0,0,0,0,0,0,0,0,0;;
That guy at the start with the hat reminds me of [NAME],0,0,0,0,0,1,0,0,0,0,0,0,0,0,0,0,0,0,0,0,0,0,0,0,0,0,0,0;;
Curious as to why he's been passed up so many times now.,0,0,0,0,0,0,0,1,0,0,0,0,0,0,0,0,0,0,0,0,0,0,0,0,0,0,0,0;;
And for pro-Syrian-rebel tweeting (which means anti-Western leftists): [NAME],0,0,0,0,0,0,0,0,0,0,0,0,0,0,0,0,0,0,0,0,0,0,0,0,0,0,0,1;;
Here you can see for yourselves,0,0,0,0,0,0,0,0,0,0,0,0,0,0,0,0,0,0,0,0,0,0,0,0,0,0,0,1;;
Good for them,0,0,0,0,1,0,0,0,0,0,0,0,0,0,0,0,0,0,0,0,0,0,0,0,0,0,0,0;;
Parents drugging their kids to prove a point. I love it.,1,0,0,0,0,0,0,0,0,0,0,0,0,0,0,0,0,0,1,0,0,0,0,0,0,0,0,0;;
"Don't you have a cashier to hassle somewhere? Go find something without a price tag and then tell them ""I guess it's free!"",0,1,0,0,0,0,0,1,0,0,0,0,0,0,0,0,0,0,0,0,0,0,0,0,0,0,0,0";;
Leave him alone!,0,0,0,0,0,0,0,0,0,0,0,0,0,0,0,0,0,0,0,0,0,0,0,0,0,0,0,1;;
I honestly donÉ??t remember anything about AS3 itÉ??s all a blur after the bitcholer,0,0,0,0,0,0,0,0,0,0,0,0,0,0,0,0,0,0,0,0,0,0,0,0,0,0,0,1;;
It's not like anyone else is ever a jerk on twitter of course.,0,0,0,0,0,0,0,0,0,1,0,0,0,0,0,0,0,0,0,0,0,0,0,0,0,0,0,0;;
Because a thought can qualify as racist without intention of effect in the same way that a thought can be transphobic without intention or effect.,0,0,0,0,0,0,0,0,0,0,0,0,0,0,0,0,0,0,0,0,0,0,1,0,0,0,0,0;;
How you ask? Simple answer, by voting.....or not hence the importance of voting,0,0,0,0,0,0,1,0,0,0,0,0,0,0,0,0,0,0,0,0,0,0,0,0,0,0,0,0;;
It doesnÉ??t get better than that,0,0,0,0,0,0,0,0,0,0,1,0,0,0,0,0,0,0,0,0,0,0,0,0,0,0,0,0;;
Nothing seems to intrigue or satisfy me only drugs and thats sad.,0,0,0,0,0,0,0,0,0,1,0,0,0,0,0,0,0,0,0,0,0,0,0,0,0,0,0,0;;
[NAME] fuck those creeps,0,0,0,1,0,0,0,0,0,0,0,1,0,0,0,0,0,0,0,0,0,0,0,0,0,0,0,0;;
Well what would make us special? He's vouching for his friend.,0,0,0,0,0,0,0,0,0,0,0,0,0,0,0,0,0,0,0,0,0,0,0,0,0,0,0,1;;
She always looks sticky.,0,0,0,0,0,0,0,0,0,0,1,0,0,0,0,0,0,0,0,0,0,0,0,0,0,0,0,0;;
Ok, thanks!,0,0,0,0,0,0,0,0,0,0,0,0,0,0,0,1,0,0,0,0,0,0,0,0,0,0,0,0;;
"...starts Jan 1. ""Published Jan 2"" Way to hit that breaking news.,0,0,0,0,0,0,0,0,0,0,0,0,0,0,0,0,0,0,0,0,0,0,0,0,0,0,0,1";;
Interesting. Never heard of it. Do you like it?,0,0,0,0,0,0,0,0,0,0,0,0,0,1,0,0,0,1,0,0,0,0,0,0,0,0,0,0;;
At least you werenÉ??t talking to a [NAME]!,0,0,0,0,0,0,0,0,0,0,0,0,0,0,0,0,0,0,0,0,0,0,0,0,0,0,0,1;;
You were taken care of with stolen money.,0,0,0,0,0,1,0,0,0,0,0,0,0,0,0,0,0,0,0,0,0,0,1,0,0,0,0,0;;
No op. No one had ever done that.,0,0,0,0,0,0,0,0,0,0,0,0,0,0,0,0,0,0,0,0,0,0,0,0,0,0,0,1;;
Wow, great news bro!,0,0,0,0,0,0,0,0,0,0,0,0,0,0,0,0,0,1,0,0,0,0,0,0,0,0,0,0;;
[NAME] pulling in his inner [NAME],0,1,0,0,0,0,0,0,0,0,0,0,0,0,0,0,0,0,0,0,0,0,0,0,0,0,0,0;;
That's not irony. Just coincidence. (I know this is [NAME] tweet).,0,0,0,0,0,0,0,0,0,0,1,0,0,0,0,0,0,0,0,0,0,0,0,0,0,0,0,0;;
ItÉ??s selfish to not want to march with people who believe youÉ??re termites and [NAME] killers?,0,0,0,0,0,0,0,0,0,0,0,0,0,0,0,0,0,0,0,0,0,0,0,0,0,0,0,1;;
My only criticism is xhaka, too slow on and off the ball.,0,0,0,0,0,0,0,0,0,0,0,0,0,0,0,0,0,0,0,0,0,0,0,0,0,0,0,1;;
Idk, I couldn't imagine getting a bag of detergent and mistaking it for heroin,0,0,0,0,0,0,0,0,0,0,0,0,0,0,0,0,0,0,0,0,0,0,0,0,0,0,0,1;;
As I understand if our Libel laws had been as shitty as the ones in the UK he could.,0,0,0,0,0,0,0,0,0,0,0,0,0,0,0,0,0,0,0,0,0,0,0,0,0,0,0,1;;
I apologize for doubting you.,0,0,0,0,0,0,0,0,0,1,0,0,1,0,0,0,0,0,0,0,0,0,1,0,0,1,0,0;;
Agghh this is amazing! Wish I had thought of something like this when I was leaving retail!,1,0,0,0,0,0,0,0,1,0,0,0,0,0,0,0,0,0,0,0,0,0,0,0,0,0,0,0;;
If all else was equal itÉ??d be a good idea but I donÉ??t think itÉ??s feasible.,0,0,0,0,1,0,0,0,0,0,1,0,0,0,0,0,0,0,0,0,0,0,0,0,0,0,0,0;;
He missed out on a golden kid. You should be proud of yourself, congrats!,0,0,0,0,0,0,0,0,0,0,0,0,0,0,0,1,0,0,0,0,0,1,0,0,0,0,0,0;;
I really hope for it to fail miserably, so we can all agree on the sequel trilogy never happened.,0,0,0,0,1,0,0,0,0,0,0,0,0,0,0,0,0,0,0,0,0,0,0,0,0,0,0,0;;
Glad it's not just me!,0,0,0,0,0,0,0,0,0,0,0,0,0,0,0,0,0,1,0,0,0,0,0,0,0,0,0,0;;
Go to rehab,0,0,0,0,0,0,0,0,0,0,0,0,0,0,0,0,0,0,0,0,0,0,0,0,0,0,0,1;;
That pole and cheap plastic fence surely would offer excellent protection from a car. Walk it off brah.,0,0,0,0,1,0,0,0,0,0,0,0,0,0,0,0,0,0,0,0,0,0,0,0,0,0,0,0;;
"Safeco had these chocolate covered ""fruit kabobs"" that were damn good. ,1,0,0,0,0,0,0,0,0,0,0,0,0,0,0,0,0,0,0,0,0,0,0,0,0,0,0,0";;
Thank you for educating me. Lol,0,0,0,0,0,0,0,0,0,0,0,0,0,0,0,1,0,0,0,0,0,0,0,0,0,0,0,0;;
It's like he saw it coming and wanted it to be close, so he kept his speed just to show the Xterra that they were wrong. ,0,0,0,0,0,0,0,0,0,0,0,0,0,0,0,0,0,0,0,0,0,0,0,0,0,0,0,1;;
Nah man. This website smells like toast and makes my left arm hurt.,0,0,0,1,0,0,0,0,0,0,1,1,0,0,0,0,0,0,0,0,0,0,0,0,0,0,0,0;;
"not just ""got hurt"" but nearly stabbed his eye out!!!,0,0,0,0,0,0,0,0,0,0,0,0,0,0,0,0,0,0,0,0,0,0,0,0,0,0,0,1";;
I'm unsure how much more I should invest in this train of thought.,0,0,0,0,0,0,0,1,0,0,1,0,0,0,0,0,0,0,0,0,0,0,0,0,0,0,0,0;;
You shouldn't skip to any scene. This is a masterpiece from start to finish.,1,0,0,0,0,0,0,0,0,0,0,0,0,0,0,0,0,0,0,0,0,0,0,0,0,0,0,0;;
Doesn't look like any 12 year old I've ever seen.,0,0,0,0,0,0,0,0,0,0,0,0,0,0,0,0,0,0,0,0,0,0,0,0,0,0,0,1;;
I used to really like [NAME]. Now she is the worst :(,0,0,0,1,0,0,0,0,0,0,0,0,0,0,0,0,0,0,0,0,0,0,0,0,0,0,0,0;;
Depends on what you want to do, but I'd buy This,0,0,0,0,1,0,0,0,0,0,0,0,0,0,0,0,0,0,0,0,0,0,0,0,0,0,0,0;;
LETS GO WE SACRAFICED ALL THOSE OPEN THREES FOR [NAME] [NAME] TO HIT THE CLUTCH THREE,0,0,0,0,0,0,0,0,0,0,0,0,0,0,0,0,0,0,0,0,0,0,0,0,0,0,0,1;;
Based on what I've seen, all the INFJ girls seem to be blue-haired damaged moonquacks that got abandoned by daddy.,0,0,0,0,0,0,0,0,0,0,0,0,0,0,0,0,0,0,0,0,0,0,0,0,0,0,0,1;;
Hey, keep us updated ,0,0,0,0,0,0,0,0,0,0,0,0,0,0,0,0,0,0,0,0,0,0,0,0,0,0,0,1;;
Severally normal people. He stopped supporting these people once the facts came out,0,0,0,0,0,0,0,0,0,0,0,0,0,0,0,0,0,0,0,0,0,0,0,0,0,0,0,1;;
Like ConfusedYehud, I'm also curious why there is a difference between a woman's face in a newspaper and a woman's face in the street.,0,0,0,0,0,0,0,1,0,0,0,0,0,0,0,0,0,0,0,0,0,0,0,0,0,0,0,0;;
There's no excuse for him not reciprocating it's pure laziness. What about a 69?,0,0,0,0,0,0,0,1,0,0,0,0,0,0,0,0,0,0,0,0,0,0,0,0,0,0,0,0;;
My grandchild used to be a baby, and now he is no longer a baby. Thanks, xBox!,0,0,0,0,0,0,0,0,0,0,0,0,0,0,0,1,0,0,0,0,0,0,1,0,0,0,0,0;;
IÉ??ve massively improved but it never really gets cured. There are always situations that will give you anxiety.,0,0,0,0,0,0,0,0,0,1,0,0,0,0,0,0,0,0,0,0,0,0,1,0,0,0,0,0;;
Always felt like this match would go 5. Come on [NAME]!,0,0,0,0,0,0,0,0,0,0,0,0,0,0,0,0,0,0,0,0,0,0,0,0,1,0,0,0;;
Copy pasta?,0,0,0,0,0,0,0,0,0,0,0,0,0,0,0,0,0,0,0,0,0,0,0,0,0,0,0,1;;
i love [NAME] and [NAME] so much, but... [NAME], my dudes.,0,0,0,0,0,0,0,0,0,0,0,0,0,0,0,0,0,0,1,0,0,0,0,0,0,0,0,0;;
I really love that game. It's so chill, I played it a lot. ,0,0,0,0,0,0,0,0,0,0,0,0,0,1,0,0,0,0,1,0,0,0,0,0,0,0,0,0;;
Not sure about OP, but caffeine tends to make many people more anxious (especially those with a co-morbid anxiety disorder(s)).,0,0,0,0,0,0,0,0,0,0,0,0,0,0,0,0,0,0,0,1,0,0,0,0,0,0,0,0;;
Well good for you man. Enjoy :),0,0,0,0,0,1,0,0,0,0,0,0,0,0,0,0,0,1,0,0,0,0,0,0,0,0,0,0;;
A good character driven story? I don't think this guy watched the same movie as we did.,0,0,0,0,0,0,1,0,0,0,0,0,0,0,0,0,0,0,0,0,0,0,0,0,0,0,0,0;;
The only time you're personal behavior should be on the governments radar is when it becomes harmful to others.,0,0,0,0,0,0,0,0,0,0,0,0,0,0,0,0,0,0,0,0,0,0,0,0,0,0,0,1;;
So many of PokimaneÉ??s fans are creepy 30+ year olds. I feel so bad for her.,0,0,0,0,0,1,0,0,0,0,0,0,0,0,0,0,0,0,0,0,0,0,0,0,0,0,0,0;;
Hahaha dude that was *so* well put,1,1,0,0,0,0,0,0,0,0,0,0,0,0,0,0,0,0,0,0,0,0,0,0,0,0,0,0;;
One day I just want to show up to my parentsÉ?? with a Starbucks cup or maybe some Taco Bell on a Sunday.,0,0,0,0,0,0,0,0,0,0,0,0,0,0,0,0,0,0,0,0,0,0,0,0,0,0,0,1;;
Yeah, I see youÉ??re point. Thank you,0,0,0,0,0,0,0,0,0,0,0,0,0,0,0,1,0,0,0,0,0,0,0,0,0,0,0,0;;
Edit: I realized I dont want my story publicized. Sorry yall. Too personal for me,0,0,0,0,0,0,0,0,0,0,0,0,0,0,0,0,0,0,0,0,0,0,1,0,0,0,0,0;;
Cat looks like itÉ??s going to tell you about how much better going vegan is, or how much money she saved on cutting her own bangs.,0,0,0,0,0,0,0,0,0,0,0,0,0,0,0,0,0,0,0,0,0,0,0,0,0,0,0,1;;
Honestly I don't care if they're faked. It's an original concept that I find pretty funny,0,0,0,0,0,0,0,0,0,0,0,0,0,0,0,0,0,1,0,0,0,0,0,0,0,0,0,0;;
No prob, comes with the territiry.,0,0,0,0,0,0,0,0,0,0,0,0,0,0,0,0,0,0,0,0,0,0,0,0,0,0,0,1;;
I did. Thank you for your opinion.,0,0,0,0,0,0,0,0,0,0,0,0,0,0,0,1,0,0,0,0,0,0,0,0,0,0,0,0;;
I feel like itll be less like we imagine but similar to the magabomber. Just some crazy dude living in his van,0,1,0,0,0,0,0,0,0,0,0,0,0,0,0,0,0,0,0,0,0,0,0,0,0,0,0,0;;
ah thats my bad, she just finished the blog and im sharing it around, one sec and ill edit it. ,0,0,0,0,0,0,0,0,0,0,0,0,0,0,0,0,0,0,0,0,0,0,0,0,0,0,0,1;;
You should re-think the credibility of whoever told you otherwise. Seems snarky to me.,0,0,0,0,1,0,0,0,0,0,0,0,0,0,0,0,0,0,0,0,0,0,0,0,0,0,0,0;;
Yaaaay!!,0,0,0,0,0,0,0,0,0,0,0,0,0,1,0,0,0,0,0,0,0,0,0,0,0,0,0,0;;
 it sounds like you're setting up for a good 2019 keep the boundaries going, and I hope the surgery has no complications and everything heals up fast!!,0,0,0,0,1,0,0,0,0,0,0,0,0,0,0,0,0,0,0,0,1,0,0,0,0,0,0,0;;
Thank you! I didn't realize that.,0,0,0,0,0,0,0,0,0,0,0,0,0,0,0,1,0,0,0,0,0,0,1,0,0,0,0,0;;
This is really well put. I saved it.,1,0,0,0,0,0,0,0,0,0,0,0,0,0,0,0,0,0,0,0,0,0,0,0,0,0,0,0;;
I got through it when I got home, thanks! :),0,0,0,0,0,0,0,0,0,0,0,0,0,0,0,1,0,0,0,0,0,0,0,0,0,0,0,0;;
Yeah. You wanna call me a liar, explain why, liar.,0,0,0,0,0,0,0,0,0,0,0,0,0,0,0,0,0,0,0,0,0,0,0,0,0,0,0,1;;
Welp, can't see [NAME] beating [NAME] if she's in this form!,0,0,0,0,0,0,0,0,0,0,0,0,0,0,0,0,0,0,0,0,0,0,0,0,0,0,0,1;;
Man, I would cry tears of joy if my two-year-old cousin could just say my name, let alone say a coherent sentence.,0,0,0,0,0,0,0,0,0,0,0,0,0,0,0,0,0,1,0,0,0,0,0,0,0,0,0,0;;
Do you have a link to any news or something? I'd love to read more about it.,0,0,0,0,0,0,0,1,0,0,0,0,0,0,0,0,0,0,0,0,0,0,0,0,0,0,0,0;;
Glad to hear. Thanks for the support.,0,0,0,0,0,0,0,0,0,0,0,0,0,0,0,1,0,0,0,0,0,0,0,0,0,0,0,0;;
# IF YOU DIG THIS, THEN YOU DUG THIS. CAUSE IT'S ALL ABOUT THE NERD FIGHT PORK PIE,0,0,0,0,0,0,0,0,0,0,0,0,0,0,0,0,0,0,0,0,0,0,0,0,0,0,0,0;;
What? Who said I hated him? I dont give a damn about him either way.,0,0,0,0,0,0,0,0,0,0,0,0,0,0,0,0,0,0,0,0,0,0,0,0,0,0,0,1;;
Good dog.,1,0,0,0,0,0,0,0,0,0,0,0,0,0,0,0,0,0,0,0,0,0,0,0,0,0,0,0;;
Also a throwback to when [NAME] bathed.,0,0,0,0,0,0,0,0,0,0,0,0,0,0,0,0,0,0,0,0,0,0,0,0,0,0,0,1;;
